ASIN,Product_Row,Review_Title,Review_Content,Rating,Sentiment,Motivation_Type,Review_Date,Reviewer_Name,Country,Review_URL,Is_Competitor_File,Review_Text,Sentiment_Label,Motivation_Score,Reviewer_Profile,Verified_Purchase,Helpful_Count,Source_File,Duplicate_Count
B00D0I4YV0,,Super disappointed,These are junk. Stewart Warner used to make good stuff but not anymore. The odometer quit at 209 miles. The volt meter pegs when you turn the key on. Oil pressure reads 10 with the engine off and temp gauge is off by about 40 degrees. The gas gauge does seem to be the only one that works right.,1.0,Negative,功能需求,2025-10-28,Jeff Chrisp,US,https://www.amazon.com/gp/customer-reviews/RCUGA6MBPVUM4/ref=cm_cr_getr_d_rvw_ttl?ie=UTF8,0,These are junk. Stewart Warner used to make good stuff but not anymore. The odometer quit at 209 miles. The volt meter pegs when you turn the key on. Oil pressure reads 10 with the engine off and temp gauge is off by about 40 degrees. The gas gauge does seem to be the only one that works right.,負向,6,https://www.amazon.com/gp/profile/amzn1.account.AFYO6EUDSTLKIZ4GVDZVWQOY6DOA/ref=cm_cr_getr_d_gw_btm,Y,1.0,Review_001_Classic_Gauge_Set/B00D0I4YV0.xlsx,1
B00D0I4YV0,,That they work,1930 hot rod,5.0,Positive,品質信任,2024-12-31,Amazon Customer,US,https://www.amazon.com/gp/customer-reviews/R178XZZ3PT26BC/ref=cm_cr_getr_d_rvw_ttl?ie=UTF8,0,1930 hot rod,正向,1,https://www.amazon.com/gp/profile/amzn1.account.AGC4ZELDYAI43LLFW33URPXVKW7Q/ref=cm_cr_getr_d_gw_btm,Y,0.0,Review_001_Classic_Gauge_Set/B00D0I4YV0.xlsx,1
B00D0I4YV0,,Looks good.,Like having fittings for mechanical hookup.,5.0,Positive,外觀偏好,2023-01-08,Henry C Taylor,US,https://www.amazon.com/gp/customer-reviews/R3ESEBB11CJK55/ref=cm_cr_getr_d_rvw_ttl?ie=UTF8,0,Like having fittings for mechanical hookup.,正向,2,https://www.amazon.com/gp/profile/amzn1.account.AF2VQHVZ3XH3VYG5CGL7KOGDBWTQ/ref=cm_cr_getr_d_gw_btm,Y,0.0,Review_001_Classic_Gauge_Set/B00D0I4YV0.xlsx,1
B00D0I4YV0,,Classic hot rod gauges! Great product!,"Using in my 1928 Ford roadster, classic hot rod gauges for a classic hot rod look!",5.0,Positive,外觀偏好,2022-05-31,Justin Saunders,US,https://www.amazon.com/gp/customer-reviews/RU2TY8MWYWQN8/ref=cm_cr_getr_d_rvw_ttl?ie=UTF8,0,"Using in my 1928 Ford roadster, classic hot rod gauges for a classic hot rod look!",正向,7,https://www.amazon.com/gp/profile/amzn1.account.AECKZWM4OIE77QKCG4IODNONA5JA/ref=cm_cr_getr_d_gw_btm,Y,0.0,Review_001_Classic_Gauge_Set/B00D0I4YV0.xlsx,1
B00D0I4YV0,,The look great,I used the gauges in the dash of a 1962 Chevy tkloomk really good,4.0,Positive,品質信任,2021-02-17,Ronald Smith,US,https://www.amazon.com/gp/customer-reviews/R30STNL5Q8EW5M/ref=cm_cr_getr_d_rvw_ttl?ie=UTF8,0,I used the gauges in the dash of a 1962 Chevy tkloomk really good,正向,2,https://www.amazon.com/gp/profile/amzn1.account.AGVO7W77HATLCSLJEC7Q27E2P5UQ/ref=cm_cr_getr_d_gw_btm,Y,0.0,Review_001_Classic_Gauge_Set/B00D0I4YV0.xlsx,1
B0FGRK8J3X,,Poor cheap indian gauge they dont work,So this gauge are made in India and I order a set an thir so cheap they dont work an i can even put a cable to speedometer an it need a cable for a tech I dont recommend them,1.0,Negative,品質信任,2026-01-07,bruno,US,https://www.amazon.com/gp/customer-reviews/R2CW9DY9R8GLQ7/ref=cm_cr_getr_d_rvw_ttl?ie=UTF8,0,So this gauge are made in India and I order a set an thir so cheap they dont work an i can even put a cable to speedometer an it need a cable for a tech I dont recommend them,負向,3,https://www.amazon.com/gp/profile/amzn1.account.AHE3UIJTS3PDFNQLCHBNG4GNV3SA/ref=cm_cr_getr_d_gw_btm,Y,0.0,Review_001_Classic_Gauge_Set/B0FGRK8J3X.xlsx,2
B0FPQPWXFB,,Absolutely Stunning,"These gauges are not just for show; they actually work and work well. I've been monitoring the water temperature and oil pressure closely on my Chevy small block, and the readings are spot-on and responsive compared to my digital scanner. The tachometer picks up the signal from my MSD box cleanly with no flutter. I appreciate that they included both signal filters for the tach, which solved the erratic needle dance I've had with other brands.",5.0,Positive,功能需求,2025-09-18,JUNHEE LEE,US,https://www.amazon.com/gp/customer-reviews/RI57IQ7S3R0Y0/ref=cm_cr_getr_d_rvw_ttl?ie=UTF8,0,"These gauges are not just for show; they actually work and work well. I've been monitoring the water temperature and oil pressure closely on my Chevy small block, and the readings are spot-on and responsive compared to my digital scanner. The tachometer picks up the signal from my MSD box cleanly with no flutter. I appreciate that they included both signal filters for the tach, which solved the erratic needle dance I've had with other brands.",正向,5,https://www.amazon.com/gp/profile/amzn1.account.AHRXBM5LVYLQDR6XNAPCP3JDODFQ/ref=cm_cr_getr_d_gw_btm,,0.0,Review_001_Classic_Gauge_Set/B0FPQPWXFB.xlsx,1
B08HPC436W,,Good deal,Works great. Easy to install,5.0,Positive,品質信任,2025-06-14,Deb,US,https://www.amazon.com/gp/customer-reviews/REU3GR1UPU00J/ref=cm_cr_getr_d_rvw_ttl?ie=UTF8,1,Works great. Easy to install,正向,4,https://www.amazon.com/gp/profile/amzn1.account.AGVCQE5M4LUKQQBEN7ZZTQZDDGKQ/ref=cm_cr_getr_d_gw_btm,Y,0.0,Review_001_Classic_Gauge_Set/競品資料/B08HPC436W.xlsx,1
B08HPC436W,,These look the part,I hope they perform as good as they look. I just wish Amazon would at least give me a chance to actually use the product before asking me to review it,3.0,Neutral,外觀偏好,2023-07-21,Robert C.,US,https://www.amazon.com/gp/customer-reviews/R5NV9R6CFME2T/ref=cm_cr_getr_d_rvw_ttl?ie=UTF8,1,I hope they perform as good as they look. I just wish Amazon would at least give me a chance to actually use the product before asking me to review it,中立,2,https://www.amazon.com/gp/profile/amzn1.account.AGUTRGK6K4L6T64GGMHHVNIDDXVA/ref=cm_cr_getr_d_gw_btm,Y,0.0,Review_001_Classic_Gauge_Set/競品資料/B08HPC436W.xlsx,1
B08HPC436W,,Perfect!,This was exactly what my son wanted and needed!,5.0,Positive,其他,2022-12-26,Robin S Burke,US,https://www.amazon.com/gp/customer-reviews/R750X9R5H3OGT/ref=cm_cr_getr_d_rvw_ttl?ie=UTF8,1,This was exactly what my son wanted and needed!,正向,0,https://www.amazon.com/gp/profile/amzn1.account.AEAZTEX6QJUYSI65LXPOPE7CYQXA/ref=cm_cr_getr_d_gw_btm,Y,0.0,Review_001_Classic_Gauge_Set/競品資料/B08HPC436W.xlsx,1
B08HPC436W,,Great price.,"Just needed one of the gauges in the kit, cheaper to all of them to get the one I needed worked and looked great in my 63 xke. Have the balance of gauges to a friend.",5.0,Positive,品質信任,2021-07-31,Placeholder,US,https://www.amazon.com/gp/customer-reviews/R33O18Q05Y7I7U/ref=cm_cr_getr_d_rvw_ttl?ie=UTF8,1,"Just needed one of the gauges in the kit, cheaper to all of them to get the one I needed worked and looked great in my 63 xke. Have the balance of gauges to a friend.",正向,3,https://www.amazon.com/gp/profile/amzn1.account.AE7BY2YCCTRS257CV5M33C3MPCLA/ref=cm_cr_getr_d_gw_btm,Y,1.0,Review_001_Classic_Gauge_Set/競品資料/B08HPC436W.xlsx,1
B0BZ88PLBS,,ممتازه اوصي به,"الكروم الجانبي ممتاز
يحتاج لاضافة حساس للحراره
لكنه بشكل عام  كامل من جميع النواحي",5.0,Positive,其他,2026-01-14,mansour alhammadi,US,https://www.amazon.com/gp/customer-reviews/R2COACXMD48AJC?ie=UTF8&ASIN=B0C8S699NS,0,"الكروم الجانبي ممتاز
يحتاج لاضافة حساس للحراره
لكنه بشكل عام  كامل من جميع النواحي",正向,0,,Y,0.0,Review_001_Classic_Gauge_Set/B0C8S699NS.xlsx,1
B0BQMLT4JP,,You get what you pay for I guess.,Oil pressure gauge is unreliable and sends reading spastically all over the place one second it will read 45 psi then 245 then 5.,2.0,Negative,功能需求,2025-12-19,carrie ervin,US,https://www.amazon.com/gp/customer-reviews/R20F36EDELA64U/ref=cm_cr_getr_d_rvw_ttl?ie=UTF8,0,Oil pressure gauge is unreliable and sends reading spastically all over the place one second it will read 45 psi then 245 then 5.,負向,3,https://www.amazon.com/gp/profile/amzn1.account.AHZUKB3KNXQC6EUZBRXXFV3RME3A/ref=cm_cr_getr_d_gw_btm,Y,0.0,Review_001_Classic_Gauge_Set/B0C8S699NS.xlsx,24
B0BQMLT4JP,,Very poor product,"Do not waste your money. These are inaccurate and slow response. I would not trust these on my lawnmower much less something I care about. I learned my lesson, you get what you pay for.",1.0,Negative,品質信任,2025-12-14,Cami Ricci,US,https://www.amazon.com/gp/customer-reviews/R27SU6ODLAAKSG/ref=cm_cr_getr_d_rvw_ttl?ie=UTF8,0,"Do not waste your money. These are inaccurate and slow response. I would not trust these on my lawnmower much less something I care about. I learned my lesson, you get what you pay for.",負向,2,https://www.amazon.com/gp/profile/amzn1.account.AEAKFYYAFTBWC6L37NEOBRYZVYZA/ref=cm_cr_getr_d_gw_btm,Y,0.0,Review_001_Classic_Gauge_Set/B0C8S699NS.xlsx,24
B0BZ88PLBS,,No worth the effort to install,"Not worth the time to install. The only one that works accurately is gps speedo. Tack, feul ,oil psi, temp all  inaccurate and flash the warning lights.. look nice but wouldn't buy again.",1.0,Negative,功能需求,2025-12-13,Walt sepanski,US,https://www.amazon.com/gp/customer-reviews/R3NJ7P0YAFKK4S/ref=cm_cr_getr_d_rvw_ttl?ie=UTF8,0,"Not worth the time to install. The only one that works accurately is gps speedo. Tack, feul ,oil psi, temp all  inaccurate and flash the warning lights.. look nice but wouldn't buy again.",負向,5,https://www.amazon.com/gp/profile/amzn1.account.AECNBVJWKJNP3CKV5GVO7JNTMGTA/ref=cm_cr_getr_d_gw_btm,Y,0.0,Review_001_Classic_Gauge_Set/B0C8S699NS.xlsx,24
B0D8L4LFCD,,Look good.,Installed them into a 57 Thunderbird dash.,5.0,Positive,外觀偏好,2025-11-04,Mitch,US,https://www.amazon.com/gp/customer-reviews/R2FM6UCGWU3B8S/ref=cm_cr_getr_d_rvw_ttl?ie=UTF8,0,Installed them into a 57 Thunderbird dash.,正向,2,https://www.amazon.com/gp/profile/amzn1.account.AEDN2BWRI43CNCBCDQLGLHR2CHTQ/ref=cm_cr_getr_d_gw_btm,Y,0.0,Review_001_Classic_Gauge_Set/B0C8S699NS.xlsx,24
B0BQMHJDSF,,Good value but…,"Install is a nightmare, sending units and cluster are proprietary so no swapping sending units if they break. Never got the tach to work with my vehicle or pcm. Fuel gauge is good but bounces around a lot. Speedo gps function is nice but occasionally resets itself mid drive. Volt meter is accurate and water temp is spot on. Oil gauge has a huge range, 58 pounds is the first marker (which is pretty much the entire operating range for most v8s) not sure why you’d need 145 psi range.

Overall they look good and for the money they’re pretty nice. Not sure how long they’ll last tho",4.0,Positive,功能需求,2025-10-21,Fernando Lemus,US,https://www.amazon.com/gp/customer-reviews/R1WJZYXORWZUOR/ref=cm_cr_getr_d_rvw_ttl?ie=UTF8,0,"Install is a nightmare, sending units and cluster are proprietary so no swapping sending units if they break. Never got the tach to work with my vehicle or pcm. Fuel gauge is good but bounces around a lot. Speedo gps function is nice but occasionally resets itself mid drive. Volt meter is accurate and water temp is spot on. Oil gauge has a huge range, 58 pounds is the first marker (which is pretty much the entire operating range for most v8s) not sure why you’d need 145 psi range.

Overall they look good and for the money they’re pretty nice. Not sure how long they’ll last tho",正向,7,https://www.amazon.com/gp/profile/amzn1.account.AHWX25CKJMJGLNZASTVEIRZCILIA/ref=cm_cr_getr_d_gw_btm,Y,0.0,Review_001_Classic_Gauge_Set/B0C8S699NS.xlsx,24
B0793LBDGY,4.0,Lights on gauges to small,The lights on gauges could be better!!!,3.0,Neutral,功能需求,2025-09-29,Debra N.,US,https://www.amazon.com/gp/customer-reviews/RSU3SICUU5PDN/ref=cm_cr_getr_d_rvw_ttl?ie=UTF8,0,The lights on gauges could be better!!!,中立,4,https://www.amazon.com/gp/profile/amzn1.account.AGV5TVEXALDWI6T4YKDTJZYFZUFA/ref=cm_cr_getr_d_gw_btm,Y,0.0,Review_001_Classic_Gauge_Set/B0C8S699NS.xlsx,24
B07M9MSNZQ,18.0,Zero support and zero warranty,Gps speedometer does not work. Support is non existant,1.0,Negative,品質信任,2025-08-31,Chris I,US,https://www.amazon.com/gp/customer-reviews/REOB399O9IZYE/ref=cm_cr_getr_d_rvw_ttl?ie=UTF8,0,Gps speedometer does not work. Support is non existant,負向,2,https://www.amazon.com/gp/profile/amzn1.account.AEJREBQVYBFMWYTC5RZWWU46IJVA/ref=cm_cr_getr_d_gw_btm,Y,0.0,Review_001_Classic_Gauge_Set/B0C8S699NS.xlsx,24
B0C8MW9P1P,5.0,Great guages,Looks great in my 1931 imperial,5.0,Positive,品質信任,2025-08-12,Jg service,US,https://www.amazon.com/gp/customer-reviews/RGOSXVQBC2V1Z/ref=cm_cr_getr_d_rvw_ttl?ie=UTF8,0,Looks great in my 1931 imperial,正向,2,https://www.amazon.com/gp/profile/amzn1.account.AHWC2FE6DKL4FWDOR6KGTMM2TL2Q/ref=cm_cr_getr_d_gw_btm,Y,0.0,Review_001_Classic_Gauge_Set/B0C8S699NS.xlsx,24
B0793N7B7P,9.0,Nope,Don't buy it. The tachometer does not work. And the rest are finicky,1.0,Negative,品質信任,2025-07-25,Retlub89,US,https://www.amazon.com/gp/customer-reviews/R14T872RBTZZ5W/ref=cm_cr_getr_d_rvw_ttl?ie=UTF8,0,Don't buy it. The tachometer does not work. And the rest are finicky,負向,1,https://www.amazon.com/gp/profile/amzn1.account.AHELJKXNCEQTADF6VUE5ROX6ZHRA/ref=cm_cr_getr_d_gw_btm,Y,0.0,Review_001_Classic_Gauge_Set/B0C8S699NS.xlsx,24
B07M9MSNZQ,18.0,Need some support,Made a custom dash! Need to get ahold of them as my fuel gauge shows 20 percent but my tank is empty. Setting is correct. Oil pressure is stuck at 80 psi when I key on. Anybody know how to get ahold of these people? I don’t want to build a different dash cluster/bezel,2.0,Negative,功能需求,2025-07-24,Troy,US,https://www.amazon.com/gp/customer-reviews/R3553PBRZYPUGT/ref=cm_cr_getr_d_rvw_ttl?ie=UTF8,0,Made a custom dash! Need to get ahold of them as my fuel gauge shows 20 percent but my tank is empty. Setting is correct. Oil pressure is stuck at 80 psi when I key on. Anybody know how to get ahold of these people? I don’t want to build a different dash cluster/bezel,負向,4,https://www.amazon.com/gp/profile/amzn1.account.AFNZFV7K2ZM2BCGLPQMNGD6SUUJQ/ref=cm_cr_getr_d_gw_btm,Y,0.0,Review_001_Classic_Gauge_Set/B0C8S699NS.xlsx,24
B07M9MSNZQ,18.0,Nope,"The guages look sweet! However after my instll you can't read the guages! The tach worked crazy for seconds then went to 0 and stayed. The speedo gives you readings when it feels like. I contacted the manufacturer by email I sent pictures that was requested, they just stopped emailing me, so I'm now removing them and returning them! too much money for a product that doesn't work, on top of no response or replacements. Not worth the money or the Hassell",1.0,Negative,價格敏感,2025-07-06,Daddy Dave,US,https://www.amazon.com/gp/customer-reviews/R2N27FEYNRDND8/ref=cm_cr_getr_d_rvw_ttl?ie=UTF8,0,"The guages look sweet! However after my instll you can't read the guages! The tach worked crazy for seconds then went to 0 and stayed. The speedo gives you readings when it feels like. I contacted the manufacturer by email I sent pictures that was requested, they just stopped emailing me, so I'm now removing them and returning them! too much money for a product that doesn't work, on top of no response or replacements. Not worth the money or the Hassell",負向,4,https://www.amazon.com/gp/profile/amzn1.account.AFQ5XJ3DAOSKHKYL4RIWYQZOUONA/ref=cm_cr_getr_d_gw_btm,Y,0.0,Review_001_Classic_Gauge_Set/B0C8S699NS.xlsx,24
B07M9MSNZQ,18.0,Gauges,The tach will work for about 1 minute then just stop. Un plug it and retest and same thing. Get a replacement and no change. Different brand and problem gone.,1.0,Negative,品質信任,2025-06-29,TJ Brantman,US,https://www.amazon.com/gp/customer-reviews/R15MMZ7V9FJT2O/ref=cm_cr_getr_d_rvw_ttl?ie=UTF8,0,The tach will work for about 1 minute then just stop. Un plug it and retest and same thing. Get a replacement and no change. Different brand and problem gone.,負向,1,https://www.amazon.com/gp/profile/amzn1.account.AESBYFWYESIXEMV66Y6KUHQKT5XA/ref=cm_cr_getr_d_gw_btm,Y,0.0,Review_001_Classic_Gauge_Set/B0C8S699NS.xlsx,24
B0C8J3FKJZ,7.0,Beware don’t purchase!!!,"I am very disappointed with these gauges. I should have read the reviews first. There are a lot of purchasers that state the gauges are cheaply made and do not work properly. That is correct! I bought a 6 gauge set and had them put into my classic car for $256.00 in labor and 3 of the 6 gauges did not work. The speedometer was inaccurate, the battery gauge was inaccurate and the water temp gauge registered 240+degrees when the actual temp was 180. In addition I tried to reach out to manufacturer to no avail. Email response server error and no one answers phone. Now I’m out almost $500 parts and labor. The mechanics are going to charge me an additional $159 to remove the gauges. Very disappointed!!!",1.0,Negative,功能需求,2025-06-04,Jason Kyle madison,US,https://www.amazon.com/gp/customer-reviews/RDQS27ETIFGXB/ref=cm_cr_getr_d_rvw_ttl?ie=UTF8,0,"I am very disappointed with these gauges. I should have read the reviews first. There are a lot of purchasers that state the gauges are cheaply made and do not work properly. That is correct! I bought a 6 gauge set and had them put into my classic car for $256.00 in labor and 3 of the 6 gauges did not work. The speedometer was inaccurate, the battery gauge was inaccurate and the water temp gauge registered 240+degrees when the actual temp was 180. In addition I tried to reach out to manufacturer to no avail. Email response server error and no one answers phone. Now I’m out almost $500 parts and labor. The mechanics are going to charge me an additional $159 to remove the gauges. Very disappointed!!!",負向,8,https://www.amazon.com/gp/profile/amzn1.account.AGEOPO3CEOIVRFCHWNVS5MAU7CIQ/ref=cm_cr_getr_d_gw_btm,Y,0.0,Review_001_Classic_Gauge_Set/B0C8S699NS.xlsx,24
B0D4DLTH8H,,Dash gauges,haven’t installed yet but gauges are a perfect fit to replace the original gauges for my 1956 Ford Fairlane,4.0,Positive,功能需求,2025-05-19,Roy L.,US,https://www.amazon.com/gp/customer-reviews/R1QDSR70J2NBDO/ref=cm_cr_getr_d_rvw_ttl?ie=UTF8,0,haven’t installed yet but gauges are a perfect fit to replace the original gauges for my 1956 Ford Fairlane,正向,4,https://www.amazon.com/gp/profile/amzn1.account.AFSY4JI5G4FUDGKWRY6VTXBIPF2A/ref=cm_cr_getr_d_gw_btm,Y,0.0,Review_001_Classic_Gauge_Set/B0C8S699NS.xlsx,24
B0D8L4LFCD,,Racing Upgrade,These gauges are great. They work perfect on my Dodge charger. Every gauge has its own duty and the packaging was perfect. Packaging was sealed correctly and no damage to the box. These gauges are universal and will work on most cars from old to new. There was even a gauge with GPS integrated for the speedometer. These gauges are durable and made with high-quality material.,5.0,Positive,功能需求,2025-04-02,Isabelle,US,https://www.amazon.com/gp/customer-reviews/R34BTKKGBKQYH2/ref=cm_cr_getr_d_rvw_ttl?ie=UTF8,0,These gauges are great. They work perfect on my Dodge charger. Every gauge has its own duty and the packaging was perfect. Packaging was sealed correctly and no damage to the box. These gauges are universal and will work on most cars from old to new. There was even a gauge with GPS integrated for the speedometer. These gauges are durable and made with high-quality material.,正向,7,https://www.amazon.com/gp/profile/amzn1.account.AG7UNPK4UISLZMVF4IAOIJEH33VA/ref=cm_cr_getr_d_gw_btm,,0.0,Review_001_Classic_Gauge_Set/B0C8S699NS.xlsx,24
B0BQMLT4JP,,You get what you pay for,"Fuel gauge did not properly work even with a fuel bridge.... Water temperature center ridgeway , high and low pressure reached low.... Even bought separate replacement fuel gauge and still did not work right",2.0,Negative,功能需求,2025-04-01,Bandit,US,https://www.amazon.com/gp/customer-reviews/R1AOHAF5CATUUN/ref=cm_cr_getr_d_rvw_ttl?ie=UTF8,0,"Fuel gauge did not properly work even with a fuel bridge.... Water temperature center ridgeway , high and low pressure reached low.... Even bought separate replacement fuel gauge and still did not work right",負向,7,https://www.amazon.com/gp/profile/amzn1.account.AESSUTQN4EVLLJTBKNC2AJRNNTCA/ref=cm_cr_getr_d_gw_btm,Y,0.0,Review_001_Classic_Gauge_Set/B0C8S699NS.xlsx,24
B0793N7B7P,9.0,Professional seller!,Very nice looking gauges,5.0,Positive,功能需求,2025-03-12,Amazon Customer,US,https://www.amazon.com/gp/customer-reviews/R2A11QMKZ3B6YF/ref=cm_cr_getr_d_rvw_ttl?ie=UTF8,0,Very nice looking gauges,正向,1,https://www.amazon.com/gp/profile/amzn1.account.AGVKE2IDGKNPTSAM4HMMM54DHNFA/ref=cm_cr_getr_d_gw_btm,Y,0.0,Review_001_Classic_Gauge_Set/B0C8S699NS.xlsx,24
B0D8L5FG8W,,Nice gauges,"Really nice gauge setup, looks great, exactly as described, and performs as expected.",5.0,Positive,功能需求,2025-02-18,Brandon,US,https://www.amazon.com/gp/customer-reviews/R30OTZYF2A0IJG/ref=cm_cr_getr_d_rvw_ttl?ie=UTF8,0,"Really nice gauge setup, looks great, exactly as described, and performs as expected.",正向,2,https://www.amazon.com/gp/profile/amzn1.account.AEPGPLQJFGNKXQ4UUAJ3BF7DIKLA/ref=cm_cr_getr_d_gw_btm,,0.0,Review_001_Classic_Gauge_Set/B0C8S699NS.xlsx,24
B0D8L5FG8W,,Comprehensive set,"Looking forward to installing these gauges in my '48 Plymouth rebuild.  They have the style, great sizes for readability, mounting hardware easy to use, and come with all necessary sensors.  Probably found a new performance company.  Will update on gauge accuracy, but they seem quality and a great value.",5.0,Positive,品質信任,2025-02-12,Taborri,US,https://www.amazon.com/gp/customer-reviews/R25M83JYOYHTNG/ref=cm_cr_getr_d_rvw_ttl?ie=UTF8,0,"Looking forward to installing these gauges in my '48 Plymouth rebuild.  They have the style, great sizes for readability, mounting hardware easy to use, and come with all necessary sensors.  Probably found a new performance company.  Will update on gauge accuracy, but they seem quality and a great value.",正向,4,https://www.amazon.com/gp/profile/amzn1.account.AHRRJLQTGDFESB73PFU5KJR26TYQ/ref=cm_cr_getr_d_gw_btm,,0.0,Review_001_Classic_Gauge_Set/B0C8S699NS.xlsx,24
B0BZ88PLBS,,Works well but tachometer is useless,"Used in a classic truck and all gauges except the tachometer work very well. GPS speedometer is accurate and wiring was easy.

I think the tachometer is for use with a newer vehicle because from what I have seen you can't just connect it to the negative side of the coil.",4.0,Positive,功能需求,2025-02-06,Bluecube448,US,https://www.amazon.com/gp/customer-reviews/R2EDWQP1BUMTKC/ref=cm_cr_getr_d_rvw_ttl?ie=UTF8,0,"Used in a classic truck and all gauges except the tachometer work very well. GPS speedometer is accurate and wiring was easy.

I think the tachometer is for use with a newer vehicle because from what I have seen you can't just connect it to the negative side of the coil.",正向,8,https://www.amazon.com/gp/profile/amzn1.account.AFNRJSDGQXVEOPUHBHQPGQU4V26A/ref=cm_cr_getr_d_gw_btm,Y,2.0,Review_001_Classic_Gauge_Set/B0C8S699NS.xlsx,24
B07M9MSNZQ,18.0,Junk,"Very cheap quality. Tachometer wouldn’t stop beeping, then it completely died after about ten minutes. 👎👎👎👎👎",1.0,Negative,品質信任,2025-01-24,Paw paw X,US,https://www.amazon.com/gp/customer-reviews/R2GPXEQ861A9D3/ref=cm_cr_getr_d_rvw_ttl?ie=UTF8,0,"Very cheap quality. Tachometer wouldn’t stop beeping, then it completely died after about ten minutes. 👎👎👎👎👎",負向,2,https://www.amazon.com/gp/profile/amzn1.account.AFVZJHDX726SPIIIPVUGBE4OT4IQ/ref=cm_cr_getr_d_gw_btm,Y,0.0,Review_001_Classic_Gauge_Set/B0C8S699NS.xlsx,24
B0793N7B7P,9.0,Amazing Set of Gauges!,I rebuilt all of the gauges in my 1965 Barracuda. All of the sensors that came with the set all work and all the gauges work the way they’re supposed to. I’m very pleased with the outcome of the gauges in the dash they look amazing and it still gives it that classic look that the 60s cars had back then.,5.0,Positive,功能需求,2025-01-24,hunter,US,https://www.amazon.com/gp/customer-reviews/R2JWVBX4H9SSHQ/ref=cm_cr_getr_d_rvw_ttl?ie=UTF8,0,I rebuilt all of the gauges in my 1965 Barracuda. All of the sensors that came with the set all work and all the gauges work the way they’re supposed to. I’m very pleased with the outcome of the gauges in the dash they look amazing and it still gives it that classic look that the 60s cars had back then.,正向,5,https://www.amazon.com/gp/profile/amzn1.account.AESZWUNDOGAN3KZ5CZIKHCKAZ24A/ref=cm_cr_getr_d_gw_btm,Y,2.0,Review_001_Classic_Gauge_Set/B0C8S699NS.xlsx,24
B0D8L4LFCD,,Perfect fit,The gauges work great and are direct fit. Looks great when they light up. Great investment for the engine management.,5.0,Positive,品質信任,2025-01-11,Brandi Cambric,US,https://www.amazon.com/gp/customer-reviews/R3KYWDUOL2QK0F/ref=cm_cr_getr_d_rvw_ttl?ie=UTF8,0,The gauges work great and are direct fit. Looks great when they light up. Great investment for the engine management.,正向,4,https://www.amazon.com/gp/profile/amzn1.account.AHSHOW3IGLJMSEWEAKWYPZHNQBWQ/ref=cm_cr_getr_d_gw_btm,,0.0,Review_001_Classic_Gauge_Set/B0C8S699NS.xlsx,24
