ASIN,Product_Row,Review_Title,Review_Content,Rating,Sentiment,Motivation_Type,Review_Date,Reviewer_Name,Country,Review_URL,Is_Competitor_File,Review_Text,Sentiment_Label,Motivation_Score,Reviewer_Profile,Verified_Purchase,Helpful_Count,Source_File,Duplicate_Count
B0793N7B7P,9.0,No speedcable,"Gauges seem to be of good quality. Only issue is that the speedometer gauge does not come with a cable. And the site does not offer a recommendation for a speedcable.

The other gauges come with instruction and the corresponding sending units i.e. fuel, and oil.

The gauges fit perfectly for my after market gauge cluster bezel for a 72 pontiac.",4.0,Positive,功能需求,2020-03-21,PartyofSix,US,https://www.amazon.com/gp/customer-reviews/R39C5EVM7JNDYY/ref=cm_cr_getr_d_rvw_ttl?ie=UTF8,0,"Gauges seem to be of good quality. Only issue is that the speedometer gauge does not come with a cable. And the site does not offer a recommendation for a speedcable.

The other gauges come with instruction and the corresponding sending units i.e. fuel, and oil.

The gauges fit perfectly for my after market gauge cluster bezel for a 72 pontiac.",正向,8,https://www.amazon.com/gp/profile/amzn1.account.AEKHSGG7656HPK4VKBHENMP42DJA/ref=cm_cr_getr_d_gw_btm,,0.0,Review_001_Classic_Gauge_Set/B0C8S699NS.xlsx,24
B081JDKD5X,,Good,Good product,5.0,Positive,品質信任,2020-03-12,pam weatherly,US,https://www.amazon.com/gp/customer-reviews/R2EJVHE49P0ISW/ref=cm_cr_getr_d_rvw_ttl?ie=UTF8,0,Good product,正向,2,https://www.amazon.com/gp/profile/amzn1.account.AEXZEBT3FCYURXP3Y4UOJKFRUTYQ/ref=cm_cr_getr_d_gw_btm,Y,0.0,Review_001_Classic_Gauge_Set/B0C8S699NS.xlsx,24
B07M9MSNZQ,18.0,Work great,These gauges work great and really give a cool look to my build. I am restoring an old jeep wrangler and I am updating the whole cluster with these gauges. The setup was pretty straightforward and the GPS seems to be pretty accurate. I tried cross-checking the speedometer with my friend driving next to me and it was right on. The brightness levels are also a nice touch because at night time I like to dim them down a bit. Great product and it comes with everything you should need.,5.0,Positive,品質信任,2020-02-28,Tyler K,US,https://www.amazon.com/gp/customer-reviews/R2J9QJEF6UBDHZ/ref=cm_cr_getr_d_rvw_ttl?ie=UTF8,0,These gauges work great and really give a cool look to my build. I am restoring an old jeep wrangler and I am updating the whole cluster with these gauges. The setup was pretty straightforward and the GPS seems to be pretty accurate. I tried cross-checking the speedometer with my friend driving next to me and it was right on. The brightness levels are also a nice touch because at night time I like to dim them down a bit. Great product and it comes with everything you should need.,正向,6,https://www.amazon.com/gp/profile/amzn1.account.AGMCPWZSDHPNE7IHW3SPZ27CTUXQ/ref=cm_cr_getr_d_gw_btm,,0.0,Review_001_Classic_Gauge_Set/B0C8S699NS.xlsx,24
B078N1HHCY,9.0,Just as pictured!,"I ordered these to replace some gauges in one of my project cars, and so far they are looking great! Right now its a bit too cold to do the work, but it seems like this set came with everything I needed. I ordered the white pair, which i think has more of a traditional feel, and would fit better in an older type of car. I really wanted to get the EVO set to put into some of my Asian project cars, that will have to be another time! I liked that this set came with a bunch of gauges, you can really customize your car however you would like. I am thinking of putting these into a car for my dad, he loved the look of them. I will update once installed but so far really impressed with the quality of materials.",5.0,Positive,外觀偏好,2020-02-17,MizzyG,US,https://www.amazon.com/gp/customer-reviews/R3B0RDPJ8XXNEP/ref=cm_cr_getr_d_rvw_ttl?ie=UTF8,0,"I ordered these to replace some gauges in one of my project cars, and so far they are looking great! Right now its a bit too cold to do the work, but it seems like this set came with everything I needed. I ordered the white pair, which i think has more of a traditional feel, and would fit better in an older type of car. I really wanted to get the EVO set to put into some of my Asian project cars, that will have to be another time! I liked that this set came with a bunch of gauges, you can really customize your car however you would like. I am thinking of putting these into a car for my dad, he loved the look of them. I will update once installed but so far really impressed with the quality of materials.",正向,6,https://www.amazon.com/gp/profile/amzn1.account.AF6XUKGXQDBG42FWFZ76EZNZ4ZDA/ref=cm_cr_getr_d_gw_btm,,0.0,Review_001_Classic_Gauge_Set/B0C8S699NS.xlsx,24
B07M9MSNZQ,18.0,Nice set for older truck ! Easy to install,"I've wanted this set for a long time !  It's in my 1972 Chevy .  Wish it was metal , but it's a good set .  Was pretty easy to install , everything was labeled correctly to make it easy .  Looks very nice when installed , doesn't look cheap .",5.0,Positive,功能需求,2020-01-29,Jesse,US,https://www.amazon.com/gp/customer-reviews/RKSLC9P472D2J/ref=cm_cr_getr_d_rvw_ttl?ie=UTF8,0,"I've wanted this set for a long time !  It's in my 1972 Chevy .  Wish it was metal , but it's a good set .  Was pretty easy to install , everything was labeled correctly to make it easy .  Looks very nice when installed , doesn't look cheap .",正向,3,https://www.amazon.com/gp/profile/amzn1.account.AHJTDEZ5JMR53DDY453NNNOPGCHQ/ref=cm_cr_getr_d_gw_btm,,0.0,Review_001_Classic_Gauge_Set/B0C8S699NS.xlsx,24
B07M9MSNZQ,18.0,Great Performance!,"Digital gauges and GPS speedometer at a bargain price

This gauge set is an excellent all digital option very similar to another manufacturer’s “revolution” line. Backlighting is good with a decent range from bright to dim. Unfortunately, there is not an easy way to tie the dimming feature into a factory style switch for all gauges to be dimmed/brightened at once. The color options are easy to change and uniform across the 6 gauges in my set. The wiring harness are clearly marked as are all accessory sensors. Longer wires would be nice for all gauges. The GPS speedometer is accurate to within 1 MPH of the analog gauge in my vehicle and the GPS readout on my cellphone. The Tachometer appears to only accept an electrical signal from the vehicles ECU. This interface is not compatible with carbureted engines or the ECU in my older Toyota vehicle. In order to use this gauge I will have to research an option to get a compatible signal to the gauge from the engine distributor. While the box is frustratingly small it protects all components well and the gauges are mounted into a piece of carboard that can serve as a ready made template for a custom dash insert. All in all the gauges look very good and with the color options will complement almost any custom application. Based on price alone I have to recommend these gauges for anyone looking to update the dash of their hotrod or weekend racer.",5.0,Positive,功能需求,2020-01-16,JM,US,https://www.amazon.com/gp/customer-reviews/R2SDRVE2EZP0ZG/ref=cm_cr_getr_d_rvw_ttl?ie=UTF8,0,"Digital gauges and GPS speedometer at a bargain price

This gauge set is an excellent all digital option very similar to another manufacturer’s “revolution” line. Backlighting is good with a decent range from bright to dim. Unfortunately, there is not an easy way to tie the dimming feature into a factory style switch for all gauges to be dimmed/brightened at once. The color options are easy to change and uniform across the 6 gauges in my set. The wiring harness are clearly marked as are all accessory sensors. Longer wires would be nice for all gauges. The GPS speedometer is accurate to within 1 MPH of the analog gauge in my vehicle and the GPS readout on my cellphone. The Tachometer appears to only accept an electrical signal from the vehicles ECU. This interface is not compatible with carbureted engines or the ECU in my older Toyota vehicle. In order to use this gauge I will have to research an option to get a compatible signal to the gauge from the engine distributor. While the box is frustratingly small it protects all components well and the gauges are mounted into a piece of carboard that can serve as a ready made template for a custom dash insert. All in all the gauges look very good and with the color options will complement almost any custom application. Based on price alone I have to recommend these gauges for anyone looking to update the dash of their hotrod or weekend racer.",正向,22,https://www.amazon.com/gp/profile/amzn1.account.AGN2HYJQUAXDWT6XJEVKR3WADCYQ/ref=cm_cr_getr_d_gw_btm,,0.0,Review_001_Classic_Gauge_Set/B0C8S699NS.xlsx,24
B078N1HB7F,4.0,Classic Gauges For Any Project,I haven’t set up all 6 gauges as I’m still working on my 98 eclipse project car but the 3 I have work as intended. The best setup I’ve seen is to place them in pillar gauge pods. The universal pods are overly big and ugly. Make sure your lines and fittings are the correct size and your pressure plates are functioning correctly.,5.0,Positive,功能需求,2020-01-12,Kevin D. Rogers,US,https://www.amazon.com/gp/customer-reviews/R24EIFJBVJN37V/ref=cm_cr_getr_d_rvw_ttl?ie=UTF8,0,I haven’t set up all 6 gauges as I’m still working on my 98 eclipse project car but the 3 I have work as intended. The best setup I’ve seen is to place them in pillar gauge pods. The universal pods are overly big and ugly. Make sure your lines and fittings are the correct size and your pressure plates are functioning correctly.,正向,4,https://www.amazon.com/gp/profile/amzn1.account.AF3DH4S4HIU7O4MJ7EBUQAL6NZZQ/ref=cm_cr_getr_d_gw_btm,,0.0,Review_001_Classic_Gauge_Set/B0C8S699NS.xlsx,24
B0793LBDGY,4.0,Excelente producto,"Buen producto muy bonitos , esperar instalarlos para que funcionen ...falta proteger el anillo cromado para que no se averien",5.0,Positive,其他,2020-01-11,luis fernando beltran martinez,US,https://www.amazon.com/gp/customer-reviews/R7VL1S1UT2YKG/ref=cm_cr_getr_d_rvw_ttl?ie=UTF8,0,"Buen producto muy bonitos , esperar instalarlos para que funcionen ...falta proteger el anillo cromado para que no se averien",正向,0,https://www.amazon.com/gp/profile/amzn1.account.AH46XYHO2QZAOT6FEJ3VF6RP33NA/ref=cm_cr_getr_d_gw_btm,Y,0.0,Review_001_Classic_Gauge_Set/B0C8S699NS.xlsx,24
B0793LBDGY,4.0,The quality is amazing,"I can't say enough about the quality of these gauges. I have tested them all and they all work great, I will be placing these in a vintage car shortly.",5.0,Positive,品質信任,2020-01-08,Daniel,US,https://www.amazon.com/gp/customer-reviews/R3BNZWJ7VHCNM0/ref=cm_cr_getr_d_rvw_ttl?ie=UTF8,0,"I can't say enough about the quality of these gauges. I have tested them all and they all work great, I will be placing these in a vintage car shortly.",正向,4,https://www.amazon.com/gp/profile/amzn1.account.AHY25BETKC5A5DCRVKMBWBVAY2OQ/ref=cm_cr_getr_d_gw_btm,,0.0,Review_001_Classic_Gauge_Set/B0C8S699NS.xlsx,24
B0793N7B7P,9.0,Great guages for the money,"Man I like these guages they look great in my truck, the only problem I have is that the speedo and tach were not as large as I was thinking but never the less they are great",5.0,Positive,品質信任,2020-01-06,Shawna,US,https://www.amazon.com/gp/customer-reviews/R1D7KB4DP5D3ZH/ref=cm_cr_getr_d_rvw_ttl?ie=UTF8,0,"Man I like these guages they look great in my truck, the only problem I have is that the speedo and tach were not as large as I was thinking but never the less they are great",正向,3,https://www.amazon.com/gp/profile/amzn1.account.AHDWBPJKEOPDGO26BDCG27ET3LSQ/ref=cm_cr_getr_d_gw_btm,Y,0.0,Review_001_Classic_Gauge_Set/B0C8S699NS.xlsx,24
B078N1HB7F,4.0,Very nice,"Gauges look great and come with almost everything needed, since every vehicle is different I can't say everything needed. Fit and finish is quality and was surprised at the accessories. Pigtails, sensors, and even a fuel float. Really a great setup.",5.0,Positive,品質信任,2020-01-04,W. Webster,US,https://www.amazon.com/gp/customer-reviews/R3D4NW3K12QN3K/ref=cm_cr_getr_d_rvw_ttl?ie=UTF8,0,"Gauges look great and come with almost everything needed, since every vehicle is different I can't say everything needed. Fit and finish is quality and was surprised at the accessories. Pigtails, sensors, and even a fuel float. Really a great setup.",正向,3,https://www.amazon.com/gp/profile/amzn1.account.AH3UMQLILVHUF5KNKQIRF4RMFH4A/ref=cm_cr_getr_d_gw_btm,,0.0,Review_001_Classic_Gauge_Set/B0C8S699NS.xlsx,24
B0793N7B7P,9.0,Really nice !!!,Really nice set !!! It even comes with the fuel sending unit !!!,5.0,Positive,功能需求,2019-12-27,Amazon Customer,US,https://www.amazon.com/gp/customer-reviews/R2LOXIC3Y49S3X/ref=cm_cr_getr_d_rvw_ttl?ie=UTF8,0,Really nice set !!! It even comes with the fuel sending unit !!!,正向,1,https://www.amazon.com/gp/profile/amzn1.account.AH5ND4CONFEMLRBFCS75ATMMOUSQ/ref=cm_cr_getr_d_gw_btm,Y,0.0,Review_001_Classic_Gauge_Set/B0C8S699NS.xlsx,24
B0793N7B7P,9.0,Great gauges for your restomod projects!,"These gauges are perfect for someone that is doing a restomod project or anything similar to that. They appear to be pretty good quality and look like they will last a long time. Time will tell if they last or not. You also get a choice of mechanical vs. Electrical or GPS gauges which is a great thing for different applications. Hooking up the mechanical cable require some work but can be done, after all you're installing aftermarket gauges in your vehicle so if you're capable of doing that you should have no issues hooking up the cable.
I'm installing these on a 1971 Willys Jeep. Going to look great when all done! Will try to remember to come back here add pictures when the car is all finished.

If this review helped you at all; please mark it helpful! Thanks!",5.0,Positive,功能需求,2019-12-26,Jimster480,US,https://www.amazon.com/gp/customer-reviews/RA851KKQXEQTN/ref=cm_cr_getr_d_rvw_ttl?ie=UTF8,0,"These gauges are perfect for someone that is doing a restomod project or anything similar to that. They appear to be pretty good quality and look like they will last a long time. Time will tell if they last or not. You also get a choice of mechanical vs. Electrical or GPS gauges which is a great thing for different applications. Hooking up the mechanical cable require some work but can be done, after all you're installing aftermarket gauges in your vehicle so if you're capable of doing that you should have no issues hooking up the cable.
I'm installing these on a 1971 Willys Jeep. Going to look great when all done! Will try to remember to come back here add pictures when the car is all finished.

If this review helped you at all; please mark it helpful! Thanks!",正向,7,https://www.amazon.com/gp/profile/amzn1.account.AEGY6WIZSKZLEO7NSLDQXSMXVGWQ/ref=cm_cr_getr_d_gw_btm,,1.0,Review_001_Classic_Gauge_Set/B0C8S699NS.xlsx,24
B07M9MSNZQ,18.0,Very nice and accurate guages,These gauges look amazing! You change the colors to match your cars interior which I love. The install wasn't too difficult and includes everything you need to include wires and mounting brackets. I like that these gauges store your max readings if you select that option. I used these in my 77 Vette which the 4 small gauges fit nicely in the center console but had to make some brackets to fit the large gauges in the main dash as the old ones were much larger than these. Only issue might be that the tach and speedo could be larger for some vehicles fitment but they still look amazing and work very well. These guages are farely shallow so they don't take up much room behind he panel you mount them too.,5.0,Positive,功能需求,2019-12-18,Sterling L. Robertson,US,https://www.amazon.com/gp/customer-reviews/R3LUJJWVBO54OK/ref=cm_cr_getr_d_rvw_ttl?ie=UTF8,0,These gauges look amazing! You change the colors to match your cars interior which I love. The install wasn't too difficult and includes everything you need to include wires and mounting brackets. I like that these gauges store your max readings if you select that option. I used these in my 77 Vette which the 4 small gauges fit nicely in the center console but had to make some brackets to fit the large gauges in the main dash as the old ones were much larger than these. Only issue might be that the tach and speedo could be larger for some vehicles fitment but they still look amazing and work very well. These guages are farely shallow so they don't take up much room behind he panel you mount them too.,正向,6,https://www.amazon.com/gp/profile/amzn1.account.AEEXQ4WW53QCLF3CQETVOFUR4T5A/ref=cm_cr_getr_d_gw_btm,,0.0,Review_001_Classic_Gauge_Set/B0C8S699NS.xlsx,24
B0793N7B7P,9.0,More information about the cages,"The fuel gauge I have to replace the fuel level
 RPM gauge is not working right",2.0,Negative,功能需求,2019-11-26,Wilfredo m.,US,https://www.amazon.com/gp/customer-reviews/R31TFLUHDX9EJB/ref=cm_cr_getr_d_rvw_ttl?ie=UTF8,0,"The fuel gauge I have to replace the fuel level
 RPM gauge is not working right",負向,4,https://www.amazon.com/gp/profile/amzn1.account.AHJW6GQVWMHJVNUFFQ5XN2CTV5DQ/ref=cm_cr_getr_d_gw_btm,Y,0.0,Review_001_Classic_Gauge_Set/B0C8S699NS.xlsx,24
B078N1HHCY,9.0,"Looks great just don't like the lights, will be changing then to led",Nice design,4.0,Positive,外觀偏好,2019-11-05,Clifton Richardson,US,https://www.amazon.com/gp/customer-reviews/R3CMZLKCI7AVQD/ref=cm_cr_getr_d_rvw_ttl?ie=UTF8,0,Nice design,正向,3,https://www.amazon.com/gp/profile/amzn1.account.AHQDCN2RWOYG35YDLVGJZSZK4ZLA/ref=cm_cr_getr_d_gw_btm,Y,1.0,Review_001_Classic_Gauge_Set/B0C8S699NS.xlsx,24
B078N1HB7F,4.0,Super,Esta major que en la foto 100%,5.0,Positive,其他,2019-11-05,Amazon Customer,US,https://www.amazon.com/gp/customer-reviews/R19ANCR8WJZFJL/ref=cm_cr_getr_d_rvw_ttl?ie=UTF8,0,Esta major que en la foto 100%,正向,0,https://www.amazon.com/gp/profile/amzn1.account.AEYLHQJWFD7JCXTA7GIMMWJF4F3Q/ref=cm_cr_getr_d_gw_btm,Y,0.0,Review_001_Classic_Gauge_Set/B0C8S699NS.xlsx,24
B0793N7B7P,9.0,Perfect,Perfect quality... Thank you,5.0,Positive,品質信任,2019-10-30,Erdem Erciyas,US,https://www.amazon.com/gp/customer-reviews/R2NEUI80V97JNL/ref=cm_cr_getr_d_rvw_ttl?ie=UTF8,0,Perfect quality... Thank you,正向,1,https://www.amazon.com/gp/profile/amzn1.account.AGQ64ZFZEGUUCUPG2LDTR3R3JOVQ/ref=cm_cr_getr_d_gw_btm,Y,0.0,Review_001_Classic_Gauge_Set/B0C8S699NS.xlsx,24
B078N1HB7F,4.0,adjusting speedometer,cannot get the speed set it is either too fast or too slow !!tried everything & the tac is erratic when you first start it is right but when you accelerate it starts jumping up & down with out accelerating . the speedometer is electric .,2.0,Negative,功能需求,2019-10-20,cynthia l.,US,https://www.amazon.com/gp/customer-reviews/R2NSGMSXVJKXOL/ref=cm_cr_getr_d_rvw_ttl?ie=UTF8,0,cannot get the speed set it is either too fast or too slow !!tried everything & the tac is erratic when you first start it is right but when you accelerate it starts jumping up & down with out accelerating . the speedometer is electric .,負向,2,https://www.amazon.com/gp/profile/amzn1.account.AGYAR465XVA2IOWPLIHJM7SH7EYA/ref=cm_cr_getr_d_gw_btm,Y,2.0,Review_001_Classic_Gauge_Set/B0C8S699NS.xlsx,24
B0793N7B7P,9.0,Awesome,Looks great...super easy to install...thanks,5.0,Positive,外觀偏好,2019-10-09,Pj,US,https://www.amazon.com/gp/customer-reviews/R1FQCG38PZH0EJ/ref=cm_cr_getr_d_rvw_ttl?ie=UTF8,0,Looks great...super easy to install...thanks,正向,2,https://www.amazon.com/gp/profile/amzn1.account.AGDUAK4QZ34VXUSOIBYFGVUZVUHQ/ref=cm_cr_getr_d_gw_btm,Y,0.0,Review_001_Classic_Gauge_Set/B0C8S699NS.xlsx,24
B078N1HHCY,9.0,Perfect for Nostalgia,These where exactly what I wanted. I am doing a 1950 Ford F1 restomod and these are modern with a vintage look.  Great product!,5.0,Positive,品質信任,2019-10-08,Steven Corley,US,https://www.amazon.com/gp/customer-reviews/R2NYF6OPHWY9M2/ref=cm_cr_getr_d_rvw_ttl?ie=UTF8,0,These where exactly what I wanted. I am doing a 1950 Ford F1 restomod and these are modern with a vintage look.  Great product!,正向,1,https://www.amazon.com/gp/profile/amzn1.account.AH4H4DSNVH2G4PPNWZAGJIXHG46A/ref=cm_cr_getr_d_gw_btm,Y,1.0,Review_001_Classic_Gauge_Set/B0C8S699NS.xlsx,24
B0793LBDGY,4.0,Odometer gauge stuck at 99.9 Miles! Speedometer noisey. Looks awesome!,"I want to say that I really love these gauges. Purchased to upgrade my fully restored 1988 Chevy G20 Conversion van. Indeed, these took some work to make them fit in the stock gauge slots. I have to do this on weekends and when I have free time (not often) so it took several months to get to this project and finish. The gauges do look awesome... But that's where the good news ends.

After installing and driving around a bit, the odometer gauge got stuck at 99.9 miles. Also the speedometer itself is somewhat noisy and the needle bobs a bit at low speeds. Once you get going at about 35 mph it smooths out, but still has a bit of noise. For comparison, my stock gauges had no issue's like this.

Looks wise, these are absolutely beautiful gauges. But I'm very disappointed with the speedometer / odometer. Had I known, I would have gone with the GPS version instead of the analog version of the speedometer. In searching the Q & A - I see a few replies noting that none of the gauges can be independently ordered. :( I'd highly advise to avoid the analog speedometer.

A word to the wise: When I initially purchased, I asked the seller a question or two and he was awesome at helping. I needed to also purchase a few extra parts to smooth out the tach signal, and an adapter for my stock Chevy speedometer cable. However, because I waited so long to finish my project - I'm now out of warranty. I went through a lot to get this done, and I feel as if I may have wasted my time and money.

Seller, if there is anything you can do - please advise. I really do love the look of these gauges, as they have the vintage style I was after. I just wish I could get this speedometer to work the way it was intended.",3.0,Neutral,功能需求,2019-09-05,Amazon Customer,US,https://www.amazon.com/gp/customer-reviews/R29GGEFPTX6IA0/ref=cm_cr_getr_d_rvw_ttl?ie=UTF8,0,"I want to say that I really love these gauges. Purchased to upgrade my fully restored 1988 Chevy G20 Conversion van. Indeed, these took some work to make them fit in the stock gauge slots. I have to do this on weekends and when I have free time (not often) so it took several months to get to this project and finish. The gauges do look awesome... But that's where the good news ends.

After installing and driving around a bit, the odometer gauge got stuck at 99.9 miles. Also the speedometer itself is somewhat noisy and the needle bobs a bit at low speeds. Once you get going at about 35 mph it smooths out, but still has a bit of noise. For comparison, my stock gauges had no issue's like this.

Looks wise, these are absolutely beautiful gauges. But I'm very disappointed with the speedometer / odometer. Had I known, I would have gone with the GPS version instead of the analog version of the speedometer. In searching the Q & A - I see a few replies noting that none of the gauges can be independently ordered. :( I'd highly advise to avoid the analog speedometer.

A word to the wise: When I initially purchased, I asked the seller a question or two and he was awesome at helping. I needed to also purchase a few extra parts to smooth out the tach signal, and an adapter for my stock Chevy speedometer cable. However, because I waited so long to finish my project - I'm now out of warranty. I went through a lot to get this done, and I feel as if I may have wasted my time and money.

Seller, if there is anything you can do - please advise. I really do love the look of these gauges, as they have the vintage style I was after. I just wish I could get this speedometer to work the way it was intended.",中立,21,https://www.amazon.com/gp/profile/amzn1.account.AG6LFPXFR6GRIDXHVMQUJ2JF7HVQ/ref=cm_cr_getr_d_gw_btm,Y,18.0,Review_001_Classic_Gauge_Set/B0C8S699NS.xlsx,24
B078N1HHCY,9.0,Great looking!,"They look great in the after market dash panel of the FJ40. Still working on the wiring, so hopefully I wire it right and the gauges read true.",4.0,Positive,品質信任,2019-08-18,Shaun Gridley,US,https://www.amazon.com/gp/customer-reviews/R27S2R1SCVLDWC/ref=cm_cr_getr_d_rvw_ttl?ie=UTF8,0,"They look great in the after market dash panel of the FJ40. Still working on the wiring, so hopefully I wire it right and the gauges read true.",正向,3,https://www.amazon.com/gp/profile/amzn1.account.AFJ3H3BXXZ24MFELUKDCHE7DZTBA/ref=cm_cr_getr_d_gw_btm,Y,0.0,Review_001_Classic_Gauge_Set/B0C8S699NS.xlsx,24
B0793N7B7P,9.0,Awesome guages,Super easy to install. Just the look I needed for my 1970 Ford.,5.0,Positive,功能需求,2019-08-03,Brian,US,https://www.amazon.com/gp/customer-reviews/R2CSIW44972WAQ/ref=cm_cr_getr_d_rvw_ttl?ie=UTF8,0,Super easy to install. Just the look I needed for my 1970 Ford.,正向,1,https://www.amazon.com/gp/profile/amzn1.account.AEDKOYY6IFLRUFZIYYYSMZDZTZGA/ref=cm_cr_getr_d_gw_btm,Y,0.0,Review_001_Classic_Gauge_Set/B0C8S699NS.xlsx,24
B0793LBDGY,4.0,Great deal. Great looking.,Good quality gauges,5.0,Positive,品質信任,2019-07-12,oscar rodriguez,US,https://www.amazon.com/gp/customer-reviews/R15AQDR0IGRFDS/ref=cm_cr_getr_d_rvw_ttl?ie=UTF8,0,Good quality gauges,正向,4,https://www.amazon.com/gp/profile/amzn1.account.AGFQFZBNQVOUR5MRS2J75TIX3FJA/ref=cm_cr_getr_d_gw_btm,Y,0.0,Review_001_Classic_Gauge_Set/B0C8S699NS.xlsx,24
