ASIN,Product_Row,Review_Title,Review_Content,Rating,Sentiment,Motivation_Type,Review_Date,Reviewer_Name,Country,Review_URL,Is_Competitor_File,Review_Text,Sentiment_Label,Motivation_Score,Reviewer_Profile,Verified_Purchase,Helpful_Count,Source_File,Duplicate_Count
B0D4DD23WX,,The set is complete and seems to be good quality. Large and easy to read.,"Includes everything including the fuel sending unit, the oil pressure sending unit, and the lowpass filter for the tachometer.  Wiring instructions for each gauge, gauges also labeled on the back so you don't have to keep looking at the other side to remember which one you're connecting.

If you use two or three of these gauges, the set pretty much pays for itself.",5.0,Positive,功能需求,2024-06-28,David,US,https://www.amazon.com/gp/customer-reviews/R2GFXUC3SGNL5F/ref=cm_cr_getr_d_rvw_ttl?ie=UTF8,0,"Includes everything including the fuel sending unit, the oil pressure sending unit, and the lowpass filter for the tachometer.  Wiring instructions for each gauge, gauges also labeled on the back so you don't have to keep looking at the other side to remember which one you're connecting.

If you use two or three of these gauges, the set pretty much pays for itself.",正向,8,https://www.amazon.com/gp/profile/amzn1.account.AECM5WCMMWSKICJASESQPV5JNO2A/ref=cm_cr_getr_d_gw_btm,,0.0,Review_001_Classic_Gauge_Set/B0C8S699NS.xlsx,24
B0D4DLTH8H,,Nice electric gauge set w GPS.,"This 5 pc set includes all the necessary gauges to monitor vital engine parameters. All electronic, with GPS for the speedometer. Nice white illumination. These seem to be decent quality and easy to install. Made in Taiwan.",5.0,Positive,功能需求,2024-06-22,Jspec1,US,https://www.amazon.com/gp/customer-reviews/R11UP6GMR6WJSS/ref=cm_cr_getr_d_rvw_ttl?ie=UTF8,0,"This 5 pc set includes all the necessary gauges to monitor vital engine parameters. All electronic, with GPS for the speedometer. Nice white illumination. These seem to be decent quality and easy to install. Made in Taiwan.",正向,6,https://www.amazon.com/gp/profile/amzn1.account.AFENIUQ3Y47NRNWEH4Z5G4RP7GUA/ref=cm_cr_getr_d_gw_btm,,0.0,Review_001_Classic_Gauge_Set/B0C8S699NS.xlsx,24
B0BQMLT4JP,,Beware! NOT for marine applications!,"they look nice n all but they are somewhat cheap feeling/material and the wires are tiny, I believe 20 Guage. Concerned water will get in them too. I bought for my boat which uses 14 gauge wires. I started to replace them out and after realizing how much rewiring I would have to do to make it all come together I stopped and returned them. Bought Faria brand marine gauges ($20 more) and they were almost plug and play with no calibrating needed for any of the gauges. These might be okay inside a car but I wouldn't use them for anything involving the outdoors.",1.0,Negative,功能需求,2024-06-16,Chris,US,https://www.amazon.com/gp/customer-reviews/R3MZGD1OL69D5R/ref=cm_cr_getr_d_rvw_ttl?ie=UTF8,0,"they look nice n all but they are somewhat cheap feeling/material and the wires are tiny, I believe 20 Guage. Concerned water will get in them too. I bought for my boat which uses 14 gauge wires. I started to replace them out and after realizing how much rewiring I would have to do to make it all come together I stopped and returned them. Bought Faria brand marine gauges ($20 more) and they were almost plug and play with no calibrating needed for any of the gauges. These might be okay inside a car but I wouldn't use them for anything involving the outdoors.",負向,6,https://www.amazon.com/gp/profile/amzn1.account.AHKM5H7DZYRCZ7YYARYNZWX3JKBQ/ref=cm_cr_getr_d_gw_btm,Y,0.0,Review_001_Classic_Gauge_Set/B0C8S699NS.xlsx,24
B0BQMLT4JP,,Look good,"Bought two sets of these for two different Harley's. Customer support sent video to assist with setup. Gauges look really good!
Fuel gauge requires adequate voltage to read properly, sending unit works well.
Tachometer works pretty good once you figure out the setting for it. Two cylinders are challenging but I’m sure standard 4/6/8 and two stroke boat motors etc would be perfect.
Best way for customer support is contact through Amazon seller.
Seller corrected all little issues via email.",5.0,Positive,品質信任,2024-05-18,J,US,https://www.amazon.com/gp/customer-reviews/R3242VU822GYT8/ref=cm_cr_getr_d_rvw_ttl?ie=UTF8,0,"Bought two sets of these for two different Harley's. Customer support sent video to assist with setup. Gauges look really good!
Fuel gauge requires adequate voltage to read properly, sending unit works well.
Tachometer works pretty good once you figure out the setting for it. Two cylinders are challenging but I’m sure standard 4/6/8 and two stroke boat motors etc would be perfect.
Best way for customer support is contact through Amazon seller.
Seller corrected all little issues via email.",正向,7,https://www.amazon.com/gp/profile/amzn1.account.AH2K7XH6B4YLCHUUPFUWJ4PKRHDA/ref=cm_cr_getr_d_gw_btm,Y,7.0,Review_001_Classic_Gauge_Set/B0C8S699NS.xlsx,24
B07XFHWYG2,19.0,Not plug-in play Buyers Beware,Buyers beware this company is a scam you buy these gauges at your own risk. I didn’t even open the box. They owe me $470 and told me that they will give me my money back within the next 30 days if you are thinking about buying gages do not buy these cheap Evo gauges Because they are plug-in play Buyers beware,1.0,Negative,價格敏感,2024-05-04,LV,US,https://www.amazon.com/gp/customer-reviews/R2XD8GP49J5TX5/ref=cm_cr_getr_d_rvw_ttl?ie=UTF8,0,Buyers beware this company is a scam you buy these gauges at your own risk. I didn’t even open the box. They owe me $470 and told me that they will give me my money back within the next 30 days if you are thinking about buying gages do not buy these cheap Evo gauges Because they are plug-in play Buyers beware,負向,2,https://www.amazon.com/gp/profile/amzn1.account.AHNM3Z6C3RNCJUV7C6GTE5Y76PYQ/ref=cm_cr_getr_d_gw_btm,Y,0.0,Review_001_Classic_Gauge_Set/B0C8S699NS.xlsx,24
B0BZ851KRY,,Poor Pruduct,Nothing about this set is good. No accuracy at all,1.0,Negative,品質信任,2024-03-28,Paul P.,US,https://www.amazon.com/gp/customer-reviews/R1CZ5042IAQP51/ref=cm_cr_getr_d_rvw_ttl?ie=UTF8,0,Nothing about this set is good. No accuracy at all,負向,3,https://www.amazon.com/gp/profile/amzn1.account.AEVTA7XUOEQHAWP7ZOMZMOWJQQWA/ref=cm_cr_getr_d_gw_btm,Y,0.0,Review_001_Classic_Gauge_Set/B0C8S699NS.xlsx,24
B0BZ851KRY,,Awesome,They fit perfectly in my car,5.0,Positive,規格適配,2024-02-08,Arrin,US,https://www.amazon.com/gp/customer-reviews/R8JGWDFJHF2E3/ref=cm_cr_getr_d_rvw_ttl?ie=UTF8,0,They fit perfectly in my car,正向,1,https://www.amazon.com/gp/profile/amzn1.account.AEGEO3SOBEQSUAJ3LCY33IYJIC6A/ref=cm_cr_getr_d_gw_btm,Y,1.0,Review_001_Classic_Gauge_Set/B0C8S699NS.xlsx,24
B0BZ88PLBS,,Problems Problems and More Problems,"This product is a fine looking set of gauges.  In fact they are a fantastic looking set of gauges and they looked absolutely AWSOME in my custom built dash that I built specifically for these gauges.  And that's where it all goes down hill.  The tac is jumpy with poor response.  I see others have mentioned that in their posts too.  The Temp gauge quit working in one day.  Also you will need to buy an adaptor for your temp sensor if you are installing in a GM product.  The adaptor in the kit will not fit GM.  Speaking of sensors.  Read them carefully.  Notice the Ohm range on these sensors are a little uncommon.  Meaning use the sensors provided, you stock ones will not work with these gauges.  Leading me to the fuel gauge,  With an in tank pump this is a bear.  They provide you with a cut in top load sending unit ""Generic""  however this would require you to cut your fuel tank.  Folks if you don't know what your doing when cutting a fuel tank just don't do it.  That can be extremely dangerous.  Anyway I finally custom built a bracket connected to the existing fuel pump assembly.  The pick up on the sending unit was not adjusted correctly from the factory.  I had to bend the sending unit pick up rod so when the sending unit reached dead top the gauge registered full and when the sending unit hit bottom then it registered as empty.  This is on the sending unit itself, I'm not talking about adjusting the float rod.  The volt meter worked.  The oil pressure sensor provided is very tricky to wire into a system that requires the oil pressure sensor to send a signal to the fuel relay.  Once again generic or OEM sensors will not work with these gauges.  I am so sorry, I swear I'm not one of these trolls out here bashing stuff, in fact I rarely write a bad review.  In this case, It is what it is.  I cannot recommend these gauges even to worst enemy.",1.0,Negative,功能需求,2024-02-01,Travis Scott,US,https://www.amazon.com/gp/customer-reviews/R2B4PMYO1HFFY3/ref=cm_cr_getr_d_rvw_ttl?ie=UTF8,0,"This product is a fine looking set of gauges.  In fact they are a fantastic looking set of gauges and they looked absolutely AWSOME in my custom built dash that I built specifically for these gauges.  And that's where it all goes down hill.  The tac is jumpy with poor response.  I see others have mentioned that in their posts too.  The Temp gauge quit working in one day.  Also you will need to buy an adaptor for your temp sensor if you are installing in a GM product.  The adaptor in the kit will not fit GM.  Speaking of sensors.  Read them carefully.  Notice the Ohm range on these sensors are a little uncommon.  Meaning use the sensors provided, you stock ones will not work with these gauges.  Leading me to the fuel gauge,  With an in tank pump this is a bear.  They provide you with a cut in top load sending unit ""Generic""  however this would require you to cut your fuel tank.  Folks if you don't know what your doing when cutting a fuel tank just don't do it.  That can be extremely dangerous.  Anyway I finally custom built a bracket connected to the existing fuel pump assembly.  The pick up on the sending unit was not adjusted correctly from the factory.  I had to bend the sending unit pick up rod so when the sending unit reached dead top the gauge registered full and when the sending unit hit bottom then it registered as empty.  This is on the sending unit itself, I'm not talking about adjusting the float rod.  The volt meter worked.  The oil pressure sensor provided is very tricky to wire into a system that requires the oil pressure sensor to send a signal to the fuel relay.  Once again generic or OEM sensors will not work with these gauges.  I am so sorry, I swear I'm not one of these trolls out here bashing stuff, in fact I rarely write a bad review.  In this case, It is what it is.  I cannot recommend these gauges even to worst enemy.",負向,28,https://www.amazon.com/gp/profile/amzn1.account.AGJDUN4XLNYC2YYQ6JGX5TSS7DMQ/ref=cm_cr_getr_d_gw_btm,Y,18.0,Review_001_Classic_Gauge_Set/B0C8S699NS.xlsx,24
B084ZDXMMK,11.0,Just what i needed,Perfect gauge set for my 1946 Rat Rod project. Could not be happier,5.0,Positive,功能需求,2024-01-05,Kenneth McCoy,US,https://www.amazon.com/gp/customer-reviews/R10PQLYISURMIK/ref=cm_cr_getr_d_rvw_ttl?ie=UTF8,0,Perfect gauge set for my 1946 Rat Rod project. Could not be happier,正向,1,https://www.amazon.com/gp/profile/amzn1.account.AEGAX7XVECUA6Q3XKK7LPHSON6BA/ref=cm_cr_getr_d_gw_btm,Y,1.0,Review_001_Classic_Gauge_Set/B0C8S699NS.xlsx,24
B081JDPKSV,,Installation Instructions Lacking,"After a lot of fiddling they're working, mostly. I'm not sure if the problem is my lack of mechanical aptitude, experience in doing customization or the product instructions but it seemed like a lot of extra work to get everything working. The biggest issues were the fuel tank sending unit not having a proper ground because my fuel tank has rubber cushions that isolate it from the chassis. And the tach bouncing wildly.

 I had to drop the fuel tank after installing the sender to get a decent ground which could have been avoided with better instructions. I've added an inline resistor to the tach sensor wire and that seems to have quieted the bouncing now it just reads way high on WOT. Not sure whats causing that might change the coil to see if that fixes it.

All in all the gauges look awesome and except for the tach function properly. It just seemed like a lot of extra work to get to this point.",2.0,Negative,功能需求,2023-11-22,Gireya,US,https://www.amazon.com/gp/customer-reviews/R97K74VGIIRVW/ref=cm_cr_getr_d_rvw_ttl?ie=UTF8,0,"After a lot of fiddling they're working, mostly. I'm not sure if the problem is my lack of mechanical aptitude, experience in doing customization or the product instructions but it seemed like a lot of extra work to get everything working. The biggest issues were the fuel tank sending unit not having a proper ground because my fuel tank has rubber cushions that isolate it from the chassis. And the tach bouncing wildly.

 I had to drop the fuel tank after installing the sender to get a decent ground which could have been avoided with better instructions. I've added an inline resistor to the tach sensor wire and that seems to have quieted the bouncing now it just reads way high on WOT. Not sure whats causing that might change the coil to see if that fixes it.

All in all the gauges look awesome and except for the tach function properly. It just seemed like a lot of extra work to get to this point.",負向,10,https://www.amazon.com/gp/profile/amzn1.account.AGRR2CK3NNZVFBVN2TW77F3AN4LA/ref=cm_cr_getr_d_gw_btm,Y,2.0,Review_001_Classic_Gauge_Set/B0C8S699NS.xlsx,24
B0793LBDGY,4.0,Product quality,Bought this product believing in brand quality from the past. However these gauges are as cheaply made as the Dolphin gauges I am replacing. In fact they are identical. Would not buy from them again. Seller reached out with an offer to refund purchase price which I thought was generous. I appreciate the gesture that says they do care,4.0,Positive,價格敏感,2023-11-14,Charles W Graham,US,https://www.amazon.com/gp/customer-reviews/R18JJ91QXKL3T4/ref=cm_cr_getr_d_rvw_ttl?ie=UTF8,0,Bought this product believing in brand quality from the past. However these gauges are as cheaply made as the Dolphin gauges I am replacing. In fact they are identical. Would not buy from them again. Seller reached out with an offer to refund purchase price which I thought was generous. I appreciate the gesture that says they do care,正向,3,https://www.amazon.com/gp/profile/amzn1.account.AEUHAO77UEY6QL7XONRKUJI3QHTA/ref=cm_cr_getr_d_gw_btm,Y,0.0,Review_001_Classic_Gauge_Set/B0C8S699NS.xlsx,24
B08SBVCNYT,13.0,Bad quality,Installed gauges speedometer broke after only 50 miles they sent a incomplete replacement that didn’t fix the problem and now won’t respond to emails,4.0,Positive,品質信任,2023-11-10,Mark l.,US,https://www.amazon.com/gp/customer-reviews/R2HPY6DZBZ7JW8/ref=cm_cr_getr_d_rvw_ttl?ie=UTF8,0,Installed gauges speedometer broke after only 50 miles they sent a incomplete replacement that didn’t fix the problem and now won’t respond to emails,正向,3,https://www.amazon.com/gp/profile/amzn1.account.AF4B6CXERL6TQGIDJ7VIJFBGX4MA/ref=cm_cr_getr_d_gw_btm,Y,1.0,Review_001_Classic_Gauge_Set/B0C8S699NS.xlsx,24
B0BQMHJDSF,,Great looking gauges.,I have not installed but the Gauges we delivered fast and look great. all sending units are included and are ready to install.  I hope they perform as great as they look. I was looking for a 2-1/16 tach that looked good and found these gauges that have the tach in the speedo. makes it easy in my opinion.,5.0,Positive,外觀偏好,2023-10-25,Josh,US,https://www.amazon.com/gp/customer-reviews/R242MFJYNI5Y46/ref=cm_cr_getr_d_rvw_ttl?ie=UTF8,0,I have not installed but the Gauges we delivered fast and look great. all sending units are included and are ready to install.  I hope they perform as great as they look. I was looking for a 2-1/16 tach that looked good and found these gauges that have the tach in the speedo. makes it easy in my opinion.,正向,6,https://www.amazon.com/gp/profile/amzn1.account.AFNXYPP7ZZWKEGPHR2TYMUCAH3MA/ref=cm_cr_getr_d_gw_btm,Y,0.0,Review_001_Classic_Gauge_Set/B0C8S699NS.xlsx,24
B0793LBDGY,4.0,Don't waste your money.,"The first set we received after installing each one, and of you have done any wiring you know it's time consuming, two of the gauges didn't work. So we had to take them all back out to send them back. After getting the second set and inhaling then again two of them didn't work and it was two different gauges plus the truck has all new wiring, so it was definitely the gauges. Spend the extra money and buy good ones.",1.0,Negative,功能需求,2023-10-10,Trisha Berry,US,https://www.amazon.com/gp/customer-reviews/RFK3023GIG5B2/ref=cm_cr_getr_d_rvw_ttl?ie=UTF8,0,"The first set we received after installing each one, and of you have done any wiring you know it's time consuming, two of the gauges didn't work. So we had to take them all back out to send them back. After getting the second set and inhaling then again two of them didn't work and it was two different gauges plus the truck has all new wiring, so it was definitely the gauges. Spend the extra money and buy good ones.",負向,6,https://www.amazon.com/gp/profile/amzn1.account.AGC3H55TN7MM6KP4Y4RVMSDKO5JQ/ref=cm_cr_getr_d_gw_btm,Y,0.0,Review_001_Classic_Gauge_Set/B0C8S699NS.xlsx,24
B08NVHH1WB,11.0,Very poor product support,"Gauges seem pretty good for the money, however the wiring diagram is very poor for the GPS speedometer and the tachometer. Tried to get to customer support for 4 days now and they will not respond. I wish I would have went with a little more costly set.",3.0,Neutral,功能需求,2023-09-08,Audrey Whitley,US,https://www.amazon.com/gp/customer-reviews/R1563EF6GCBJ4J/ref=cm_cr_getr_d_rvw_ttl?ie=UTF8,0,"Gauges seem pretty good for the money, however the wiring diagram is very poor for the GPS speedometer and the tachometer. Tried to get to customer support for 4 days now and they will not respond. I wish I would have went with a little more costly set.",中立,5,https://www.amazon.com/gp/profile/amzn1.account.AH7AGHHE2U322FL2NQDDZIHAH3RQ/ref=cm_cr_getr_d_gw_btm,Y,1.0,Review_001_Classic_Gauge_Set/B0C8S699NS.xlsx,24
B081JDPKSV,,Gauges don't work,"The tach, temperature gauge, and speedometer does not work",2.0,Negative,功能需求,2023-08-30,Robin D.,US,https://www.amazon.com/gp/customer-reviews/R3SK3RUXDTBD5Y/ref=cm_cr_getr_d_rvw_ttl?ie=UTF8,0,"The tach, temperature gauge, and speedometer does not work",負向,4,https://www.amazon.com/gp/profile/amzn1.account.AH3UOPEKISEEZNWHAAC2YJRT4T6A/ref=cm_cr_getr_d_gw_btm,Y,0.0,Review_001_Classic_Gauge_Set/B0C8S699NS.xlsx,24
B081JDPKSV,,Moto meter gauges,These seem to be of quality material and should stand up to the test,5.0,Positive,品質信任,2023-08-25,David hastings,US,https://www.amazon.com/gp/customer-reviews/R3A0CCHCUWICE1/ref=cm_cr_getr_d_rvw_ttl?ie=UTF8,0,These seem to be of quality material and should stand up to the test,正向,1,https://www.amazon.com/gp/profile/amzn1.account.AH6WPTTGPSF7Z7SYGBOUHFITRQJQ/ref=cm_cr_getr_d_gw_btm,Y,0.0,Review_001_Classic_Gauge_Set/B0C8S699NS.xlsx,24
B078N1HHCY,9.0,Horrible Product/ Do not buy,"This is a perfect example of “you get what you pay for”. Cheap knockoff products. The gauges are very cheaply made and these sensors are NOT matched. Just because it comes together doesn’t mean they’re matched. The lights are NOT LED, just fyi. The oil pressure sensor went out in less than a year. They say it is supposed to have a year warranty on their site but when I notified them I got his response:

 “ Thank you for your letter.
I think the main problem might be the faulty of oil pressure sensor, it has damaged after the collisions during engine operation.”

I have NO idea how to interpret this but it seems they are blaming engine vibration?!?
I’m pretty sure engines do that naturally 🤬
Don’t be scammed like me!",1.0,Negative,功能需求,2023-08-16,Charles Caudill,US,https://www.amazon.com/gp/customer-reviews/R1ZK2ETBHQZA7O/ref=cm_cr_getr_d_rvw_ttl?ie=UTF8,0,"This is a perfect example of “you get what you pay for”. Cheap knockoff products. The gauges are very cheaply made and these sensors are NOT matched. Just because it comes together doesn’t mean they’re matched. The lights are NOT LED, just fyi. The oil pressure sensor went out in less than a year. They say it is supposed to have a year warranty on their site but when I notified them I got his response:

 “ Thank you for your letter.
I think the main problem might be the faulty of oil pressure sensor, it has damaged after the collisions during engine operation.”

I have NO idea how to interpret this but it seems they are blaming engine vibration?!?
I’m pretty sure engines do that naturally 🤬
Don’t be scammed like me!",負向,9,https://www.amazon.com/gp/profile/amzn1.account.AGMEYFIFJ66ATTSMCRZUBED3L2TQ/ref=cm_cr_getr_d_gw_btm,Y,0.0,Review_001_Classic_Gauge_Set/B0C8S699NS.xlsx,24
B081JDPKSV,,Just ok,"Gauges seem to be ok, but the oil pressure gauge don’t work right. It only reads about half of what it should. Now it’s hard as heck to find a mechanical gauge to match.",2.0,Negative,功能需求,2023-08-12,Roger Edwards,US,https://www.amazon.com/gp/customer-reviews/RL8YWS6E9IKGZ/ref=cm_cr_getr_d_rvw_ttl?ie=UTF8,0,"Gauges seem to be ok, but the oil pressure gauge don’t work right. It only reads about half of what it should. Now it’s hard as heck to find a mechanical gauge to match.",負向,5,https://www.amazon.com/gp/profile/amzn1.account.AEH5AOACFMQUU7AFJX5XHI7JCTQA/ref=cm_cr_getr_d_gw_btm,Y,0.0,Review_001_Classic_Gauge_Set/B0C8S699NS.xlsx,24
B081JDPKSV,,Junk,Two of the gages did not work the main ones to speedometer and oil pressure would not even budge off zero,2.0,Negative,功能需求,2023-08-08,Chevy,US,https://www.amazon.com/gp/customer-reviews/R2SKK6S6MBQ4DL/ref=cm_cr_getr_d_rvw_ttl?ie=UTF8,0,Two of the gages did not work the main ones to speedometer and oil pressure would not even budge off zero,負向,3,https://www.amazon.com/gp/profile/amzn1.account.AGF7M4BZ3ZF6YOTXMLCHRTDFQYKA/ref=cm_cr_getr_d_gw_btm,Y,0.0,Review_001_Classic_Gauge_Set/B0C8S699NS.xlsx,24
B07M9MSNZQ,18.0,Do you really want to see them?,"Great guages unless you want to see them in the daylight. No matter the color at night they look awesome but during the day not at all. It look me 10 months to finally get them all in and working once I pulled the jeep out of the garage in sunlight I couldn't read them at all, none of them. I do not recommend them at all a waist of $500.",1.0,Negative,外觀偏好,2023-07-20,Don hansen,US,https://www.amazon.com/gp/customer-reviews/R15GNK6L6RJ5IW/ref=cm_cr_getr_d_rvw_ttl?ie=UTF8,0,"Great guages unless you want to see them in the daylight. No matter the color at night they look awesome but during the day not at all. It look me 10 months to finally get them all in and working once I pulled the jeep out of the garage in sunlight I couldn't read them at all, none of them. I do not recommend them at all a waist of $500.",負向,3,https://www.amazon.com/gp/profile/amzn1.account.AEUSEKPKYV5SVIF5WO7VFGEWMMYA/ref=cm_cr_getr_d_gw_btm,Y,1.0,Review_001_Classic_Gauge_Set/B0C8S699NS.xlsx,24
B081JDPKSV,,tach bouncy and failed temp gauge,"Have two separate kits of these gauges i have bought had one temp gauge failure at first use and tach that is very bouncy while higher quality gauges function perfectly. I even installed filter into the tach circuit with no improvement. temp gauge never worked, installed after warranty period was over....",3.0,Neutral,功能需求,2023-07-19,Ron,US,https://www.amazon.com/gp/customer-reviews/R21GUQ0PECU92H/ref=cm_cr_getr_d_rvw_ttl?ie=UTF8,0,"Have two separate kits of these gauges i have bought had one temp gauge failure at first use and tach that is very bouncy while higher quality gauges function perfectly. I even installed filter into the tach circuit with no improvement. temp gauge never worked, installed after warranty period was over....",中立,7,https://www.amazon.com/gp/profile/amzn1.account.AHUCIH4Y2SQT744JGM73TN2AKPVA/ref=cm_cr_getr_d_gw_btm,Y,1.0,Review_001_Classic_Gauge_Set/B0C8S699NS.xlsx,24
B08SBVCNYT,13.0,Unreturnable garbage,Junk,1.0,Negative,價格敏感,2023-06-27,Mary,US,https://www.amazon.com/gp/customer-reviews/R2IJD8GGHKCLLF/ref=cm_cr_getr_d_rvw_ttl?ie=UTF8,0,Junk,負向,1,https://www.amazon.com/gp/profile/amzn1.account.AF4GFPWWVPQJ35J4VC24JIKOP3SQ/ref=cm_cr_getr_d_gw_btm,Y,0.0,Review_001_Classic_Gauge_Set/B0C8S699NS.xlsx,24
B081JDKD5X,,Looks great,They look great,5.0,Positive,外觀偏好,2023-06-26,Ralph Bowler,US,https://www.amazon.com/gp/customer-reviews/R34QBOPHP58DPJ/ref=cm_cr_getr_d_rvw_ttl?ie=UTF8,0,They look great,正向,3,https://www.amazon.com/gp/profile/amzn1.account.AHEC2GZ42VG23YFPUKWZGDI37A3Q/ref=cm_cr_getr_d_gw_btm,Y,0.0,Review_001_Classic_Gauge_Set/B0C8S699NS.xlsx,24
B09DP9KY1C,4.0,Impressive gauges.,,5.0,Positive,功能需求,2023-06-20,HAROLD MCDANIEL,US,https://www.amazon.com/gp/customer-reviews/R1DXQ0CG23MDYC/ref=cm_cr_getr_d_rvw_ttl?ie=UTF8,0,,正向,1,https://www.amazon.com/gp/profile/amzn1.account.AFZBGKSNHCJMXF4WG763NPRUA36A/ref=cm_cr_getr_d_gw_btm,Y,1.0,Review_001_Classic_Gauge_Set/B0C8S699NS.xlsx,24
B07M9MSNZQ,18.0,These gauges willnt work,This product willnt work on my motorcycle,1.0,Negative,品質信任,2023-05-03,terryeastland,US,https://www.amazon.com/gp/customer-reviews/R3NUM4ZYOHRMFY/ref=cm_cr_getr_d_rvw_ttl?ie=UTF8,0,This product willnt work on my motorcycle,負向,2,https://www.amazon.com/gp/profile/amzn1.account.AEYEYGN2C4PFM2YXTRQYM4NXAGWA/ref=cm_cr_getr_d_gw_btm,Y,0.0,Review_001_Classic_Gauge_Set/B0C8S699NS.xlsx,24
