ASIN,Product_Row,Review_Title,Review_Content,Rating,Sentiment,Motivation_Type,Review_Date,Reviewer_Name,Country,Review_URL,Is_Competitor_File,Review_Text,Sentiment_Label,Motivation_Score,Reviewer_Profile,Verified_Purchase,Helpful_Count,Source_File,Duplicate_Count
B0D4DD23WX,,Que los demás tengan una guía de que tan buenos son los productos,Llegaron muy rapido y son de muy buena calidad,5.0,Positive,其他,2025-07-31,Levi JB,MX,https://www.amazon.com.mx/gp/customer-reviews/R3TELRJTS5879S?ie=UTF8&ASIN=B078N1HHCY,0,Llegaron muy rapido y son de muy buena calidad,正向,0,,Y,0.0,Review_001_Classic_Gauge_Set/B078N1HHCY.xlsx,1
B081JDPKSV,,Gauge cluster,"Proper sizing, seems to be good quality, all accessories included.",4.0,Positive,品質信任,2025-04-17,Gordon Mills,CA,https://www.amazon.ca/gp/customer-reviews/R3DWDA2ZXNVC8D?ie=UTF8&ASIN=B078N1HHCY,0,"Proper sizing, seems to be good quality, all accessories included.",正向,2,,Y,0.0,Review_001_Classic_Gauge_Set/B078N1HHCY.xlsx,1
B0793N7B7P,9.0,falta tornillería,es la segunda vez que lo compro y llega faltante de tornillería delos instrumentos,2.0,Negative,其他,2025-04-07,Jaime M.,MX,https://www.amazon.com.mx/gp/customer-reviews/R2VXJN97DM451S?ie=UTF8&ASIN=B078N1HHCY,0,es la segunda vez que lo compro y llega faltante de tornillería delos instrumentos,負向,0,,Y,0.0,Review_001_Classic_Gauge_Set/B078N1HHCY.xlsx,1
B0BZ851KRY,,"Muy bueno, la mejor opción",Muy buen producto con instrucciones y todo listo para instalar,5.0,Positive,其他,2025-03-27,D5,MX,https://www.amazon.com.mx/gp/customer-reviews/R3NXYSP89V4BAS?ie=UTF8&ASIN=B078N1HHCY,0,Muy buen producto con instrucciones y todo listo para instalar,正向,0,,Y,0.0,Review_001_Classic_Gauge_Set/B078N1HHCY.xlsx,1
B0952STSM5,14.0,muy bueno,Excelente calidad,5.0,Positive,其他,2023-06-22,Jose Roberto Ramirez Suarez,MX,https://www.amazon.com.mx/gp/customer-reviews/R1R50QW0UHB3JL?ie=UTF8&ASIN=B078N1HHCY,0,Excelente calidad,正向,0,,Y,0.0,Review_001_Classic_Gauge_Set/B078N1HHCY.xlsx,1
B081JDKD5X,,Buenos recomendados,Muy fácil de instalar viene con todo sus accesorios recomendados al 100%,5.0,Positive,其他,2022-02-24,SR.FISHER,MX,https://www.amazon.com.mx/gp/customer-reviews/R8SXI1B0XEL7U?ie=UTF8&ASIN=B078N1HHCY,0,Muy fácil de instalar viene con todo sus accesorios recomendados al 100%,正向,0,,Y,2.0,Review_001_Classic_Gauge_Set/B078N1HHCY.xlsx,1
B0793LBDGY,4.0,Oil pressure sending unit faulty tach jumps allover,Made dash to mount gauges trusting they would work to much work to take back out of vechicle,1.0,Negative,功能需求,2021-10-08,Arthur joseph,CA,https://www.amazon.ca/gp/customer-reviews/R2PHLENSTCPZ9F?ie=UTF8&ASIN=B078N1HHCY,0,Made dash to mount gauges trusting they would work to much work to take back out of vechicle,負向,3,,Y,0.0,Review_001_Classic_Gauge_Set/B078N1HHCY.xlsx,1
B0BZ88PLBS,,ممتازه اوصي به,"الكروم الجانبي ممتاز
يحتاج لاضافة حساس للحراره
لكنه بشكل عام  كامل من جميع النواحي",5.0,Positive,其他,2026-01-14,mansour alhammadi,US,https://www.amazon.com/gp/customer-reviews/R2COACXMD48AJC?ie=UTF8&ASIN=B084ZDXMMK,0,"الكروم الجانبي ممتاز
يحتاج لاضافة حساس للحراره
لكنه بشكل عام  كامل من جميع النواحي",正向,0,,Y,0.0,Review_001_Classic_Gauge_Set/B084ZDXMMK.xlsx,1
B0BZ851KRY,,Baja calidad,Sensores fallan y no son preciosos,1.0,Negative,功能需求,2025-12-05,Daniel Zamorano,MX,https://www.amazon.com.mx/gp/customer-reviews/R2MA3HYZV3N5CP?ie=UTF8&ASIN=B084ZDXMMK,0,Sensores fallan y no son preciosos,負向,1,,Y,0.0,Review_001_Classic_Gauge_Set/B084ZDXMMK.xlsx,1
B081JDPKSV,,La calidad,Bien,4.0,Positive,其他,2025-11-30,Maria Guadalupe Sandoval Ayala,MX,https://www.amazon.com.mx/gp/customer-reviews/RCYD2OL8AWV0F?ie=UTF8&ASIN=B084ZDXMMK,0,Bien,正向,0,,Y,0.0,Review_001_Classic_Gauge_Set/B084ZDXMMK.xlsx,1
B0D4DD23WX,,Que los demás tengan una guía de que tan buenos son los productos,Llegaron muy rapido y son de muy buena calidad,5.0,Positive,其他,2025-07-31,Levi JB,MX,https://www.amazon.com.mx/gp/customer-reviews/R3TELRJTS5879S?ie=UTF8&ASIN=B084ZDXMMK,0,Llegaron muy rapido y son de muy buena calidad,正向,0,,Y,0.0,Review_001_Classic_Gauge_Set/B084ZDXMMK.xlsx,1
B081JDPKSV,,Gauge cluster,"Proper sizing, seems to be good quality, all accessories included.",4.0,Positive,品質信任,2025-04-17,Gordon Mills,CA,https://www.amazon.ca/gp/customer-reviews/R3DWDA2ZXNVC8D?ie=UTF8&ASIN=B084ZDXMMK,0,"Proper sizing, seems to be good quality, all accessories included.",正向,2,,Y,0.0,Review_001_Classic_Gauge_Set/B084ZDXMMK.xlsx,1
B0793N7B7P,9.0,falta tornillería,es la segunda vez que lo compro y llega faltante de tornillería delos instrumentos,2.0,Negative,其他,2025-04-07,Jaime M.,MX,https://www.amazon.com.mx/gp/customer-reviews/R2VXJN97DM451S?ie=UTF8&ASIN=B084ZDXMMK,0,es la segunda vez que lo compro y llega faltante de tornillería delos instrumentos,負向,0,,Y,0.0,Review_001_Classic_Gauge_Set/B084ZDXMMK.xlsx,1
B0BZ851KRY,,"Muy bueno, la mejor opción",Muy buen producto con instrucciones y todo listo para instalar,5.0,Positive,其他,2025-03-27,D5,MX,https://www.amazon.com.mx/gp/customer-reviews/R3NXYSP89V4BAS?ie=UTF8&ASIN=B084ZDXMMK,0,Muy buen producto con instrucciones y todo listo para instalar,正向,0,,Y,0.0,Review_001_Classic_Gauge_Set/B084ZDXMMK.xlsx,1
B0952STSM5,14.0,muy bueno,Excelente calidad,5.0,Positive,其他,2023-06-22,Jose Roberto Ramirez Suarez,MX,https://www.amazon.com.mx/gp/customer-reviews/R1R50QW0UHB3JL?ie=UTF8&ASIN=B084ZDXMMK,0,Excelente calidad,正向,0,,Y,0.0,Review_001_Classic_Gauge_Set/B084ZDXMMK.xlsx,1
B081JDKD5X,,Buenos recomendados,Muy fácil de instalar viene con todo sus accesorios recomendados al 100%,5.0,Positive,其他,2022-02-24,SR.FISHER,MX,https://www.amazon.com.mx/gp/customer-reviews/R8SXI1B0XEL7U?ie=UTF8&ASIN=B084ZDXMMK,0,Muy fácil de instalar viene con todo sus accesorios recomendados al 100%,正向,0,,Y,2.0,Review_001_Classic_Gauge_Set/B084ZDXMMK.xlsx,1
B0793LBDGY,4.0,Oil pressure sending unit faulty tach jumps allover,Made dash to mount gauges trusting they would work to much work to take back out of vechicle,1.0,Negative,功能需求,2021-10-08,Arthur joseph,CA,https://www.amazon.ca/gp/customer-reviews/R2PHLENSTCPZ9F?ie=UTF8&ASIN=B084ZDXMMK,0,Made dash to mount gauges trusting they would work to much work to take back out of vechicle,負向,3,,Y,0.0,Review_001_Classic_Gauge_Set/B084ZDXMMK.xlsx,1
B00NO0FEFE,,Great product,Nice quality gauges that work well and function as they should. Nice bright light but not blinding.,5.0,Positive,品質信任,2025-12-13,Elizabeth,US,https://www.amazon.com/gp/customer-reviews/R3HGBENCC26W24/ref=cm_cr_getr_d_rvw_ttl?ie=UTF8,1,Nice quality gauges that work well and function as they should. Nice bright light but not blinding.,正向,3,https://www.amazon.com/gp/profile/amzn1.account.AGMZN6RXXTI6RJGVL73J7OWVEXHQ/ref=cm_cr_getr_d_gw_btm,Y,0.0,Review_001_Classic_Gauge_Set/競品資料/B00NO0FCPQ.xlsx,1
B00NO0FCPQ,1.0,Looks great,Looks great can’t wait to install in dash and has everything I need,5.0,Positive,外觀偏好,2024-07-10,robert bundzinski,US,https://www.amazon.com/gp/customer-reviews/R2SAKDXDTK0CFM/ref=cm_cr_getr_d_rvw_ttl?ie=UTF8,1,Looks great can’t wait to install in dash and has everything I need,正向,5,https://www.amazon.com/gp/profile/amzn1.account.AHNISDFSJ2T5UJ66MRKBVGPQE3NA/ref=cm_cr_getr_d_gw_btm,Y,0.0,Review_001_Classic_Gauge_Set/競品資料/B00NO0FCPQ.xlsx,1
B00NO0FEFE,,Quality,Good product,5.0,Positive,品質信任,2023-07-15,Ray younkin,US,https://www.amazon.com/gp/customer-reviews/R1A0ETRE58PPDJ/ref=cm_cr_getr_d_rvw_ttl?ie=UTF8,1,Good product,正向,2,https://www.amazon.com/gp/profile/amzn1.account.AHFANZTUANEP76B6BOAMQQ32RS3A/ref=cm_cr_getr_d_gw_btm,Y,0.0,Review_001_Classic_Gauge_Set/競品資料/B00NO0FCPQ.xlsx,1
B00NO0FCPQ,1.0,Having issues with the fuel and oil pressure gauges,"We have trouble shot the oil pressure and fuel gauges per Dolphin and then some.  They've responded and want us to send them back to checkout.  Our client doesn't want holes in his dash and wants to drive the vehicle, he's been waiting a year on the build.  So we are switching to another brand.  They could have solved this by sending a set to swap out but no, not their protocol  So we have a dissatisfied client",2.0,Negative,功能需求,2022-03-24,raspilot,US,https://www.amazon.com/gp/customer-reviews/R3O5WMTB680ZLA/ref=cm_cr_getr_d_rvw_ttl?ie=UTF8,1,"We have trouble shot the oil pressure and fuel gauges per Dolphin and then some.  They've responded and want us to send them back to checkout.  Our client doesn't want holes in his dash and wants to drive the vehicle, he's been waiting a year on the build.  So we are switching to another brand.  They could have solved this by sending a set to swap out but no, not their protocol  So we have a dissatisfied client",負向,8,https://www.amazon.com/gp/profile/amzn1.account.AE55IOGMV7SGZPGQDPEBBSXZOJFQ/ref=cm_cr_getr_d_gw_btm,,1.0,Review_001_Classic_Gauge_Set/競品資料/B00NO0FCPQ.xlsx,1
B00NO0FCPQ,1.0,Don't buy these gauges..... no support.,"I got a set of these gauges with a kit car that I purchased. The tachometer doesn't work and the speedometer adds miles (and the needle  bounces all over the place) while the car isn't moving. I called their ""customer support"" (?) number numerous times with hopes of some additional info on setting up the tach. Nobody calling me back as of yet........ ever. I've heard the same story from a lot of other buyers also. Do yourself a favor and buy anything but these gauges. Even if they were good gauges, with no support, they are worthless..... $300 down the drain.",1.0,Negative,功能需求,2021-09-25,Prowler,US,https://www.amazon.com/gp/customer-reviews/R2209RV5E9WU86/ref=cm_cr_getr_d_rvw_ttl?ie=UTF8,1,"I got a set of these gauges with a kit car that I purchased. The tachometer doesn't work and the speedometer adds miles (and the needle  bounces all over the place) while the car isn't moving. I called their ""customer support"" (?) number numerous times with hopes of some additional info on setting up the tach. Nobody calling me back as of yet........ ever. I've heard the same story from a lot of other buyers also. Do yourself a favor and buy anything but these gauges. Even if they were good gauges, with no support, they are worthless..... $300 down the drain.",負向,6,https://www.amazon.com/gp/profile/amzn1.account.AHA3XBA2R6S4UYS2GPRZEM5XRI7A/ref=cm_cr_getr_d_gw_btm,,0.0,Review_001_Classic_Gauge_Set/競品資料/B00NO0FCPQ.xlsx,1
B00NO0FEFE,,Beautiful,These things look and work beautifully,5.0,Positive,外觀偏好,2021-05-09,John Cheney II,US,https://www.amazon.com/gp/customer-reviews/R1BDRGKBGFLBOZ/ref=cm_cr_getr_d_rvw_ttl?ie=UTF8,1,These things look and work beautifully,正向,3,https://www.amazon.com/gp/profile/amzn1.account.AFXGX4G7WDYQGVIOCOHRF5OOOY6A/ref=cm_cr_getr_d_gw_btm,Y,0.0,Review_001_Classic_Gauge_Set/競品資料/B00NO0FCPQ.xlsx,1
B00NO0FCPQ,1.0,Need new gauges,1/2 of the gauges didn’t work had get another set from a different brand.  Very disappointing,1.0,Negative,功能需求,2020-02-08,jeff,US,https://www.amazon.com/gp/customer-reviews/R24TI404H4UTP1/ref=cm_cr_getr_d_rvw_ttl?ie=UTF8,1,1/2 of the gauges didn’t work had get another set from a different brand.  Very disappointing,負向,2,https://www.amazon.com/gp/profile/amzn1.account.AFHFC2EVZOVA6ESGK36MAK435TGQ/ref=cm_cr_getr_d_gw_btm,Y,0.0,Review_001_Classic_Gauge_Set/競品資料/B00NO0FCPQ.xlsx,1
B00NO0FCPQ,1.0,"Solid gauges great price, do it! You know you want to.",Works great!  And look great with my stock cluster panels.  Make sure you do not over tighten your screws that go to the back of your gauges else they won't read properly.,5.0,Positive,品質信任,2019-04-15,Jonathan Ramirez,US,https://www.amazon.com/gp/customer-reviews/R1XCR91PWVJS2P/ref=cm_cr_getr_d_rvw_ttl?ie=UTF8,1,Works great!  And look great with my stock cluster panels.  Make sure you do not over tighten your screws that go to the back of your gauges else they won't read properly.,正向,5,https://www.amazon.com/gp/profile/amzn1.account.AEKBRHKLIHMBASLX65YZXBAYPWBA/ref=cm_cr_getr_d_gw_btm,Y,6.0,Review_001_Classic_Gauge_Set/競品資料/B00NO0FCPQ.xlsx,1
B00NO0FEFE,,They look cool,The look cool work decently. Only issue is my temp gauge doesnt work havnt been able to figure if its the guage or sensor yet. My old one worked just fine this one is a different design seperate sensor on the block connected by wire to the gauge . all other gauges work good,4.0,Positive,功能需求,2018-08-07,JB,US,https://www.amazon.com/gp/customer-reviews/R1ESQHX9VS4ORQ/ref=cm_cr_getr_d_rvw_ttl?ie=UTF8,1,The look cool work decently. Only issue is my temp gauge doesnt work havnt been able to figure if its the guage or sensor yet. My old one worked just fine this one is a different design seperate sensor on the block connected by wire to the gauge . all other gauges work good,正向,6,https://www.amazon.com/gp/profile/amzn1.account.AEX2ROHK7NNTXWL5AMVHG3FQJ6JQ/ref=cm_cr_getr_d_gw_btm,Y,1.0,Review_001_Classic_Gauge_Set/競品資料/B00NO0FCPQ.xlsx,1
B00NO0FCPQ,1.0,Five Stars,"gauges are beautifully finished, and easy to install. Look great in the dash of my 60 Cadillac.Very classy looking.",5.0,Positive,外觀偏好,2018-05-31,arthur,US,https://www.amazon.com/gp/customer-reviews/R34ZNB6OSAFNNB/ref=cm_cr_getr_d_rvw_ttl?ie=UTF8,1,"gauges are beautifully finished, and easy to install. Look great in the dash of my 60 Cadillac.Very classy looking.",正向,4,https://www.amazon.com/gp/profile/amzn1.account.AGQ4VUAYF7P5LI63ZCYTBO4TUEKQ/ref=cm_cr_getr_d_gw_btm,Y,1.0,Review_001_Classic_Gauge_Set/競品資料/B00NO0FCPQ.xlsx,1
B00NO0FTKO,,great for the price,works well! great for the price!,5.0,Positive,品質信任,2017-05-16,different name,US,https://www.amazon.com/gp/customer-reviews/RRSS8ZY11CYJZ/ref=cm_cr_getr_d_rvw_ttl?ie=UTF8,1,works well! great for the price!,正向,4,https://www.amazon.com/gp/profile/amzn1.account.AGB2PMITXVYNRITOQVPTLX2YSR4Q/ref=cm_cr_getr_d_gw_btm,Y,0.0,Review_001_Classic_Gauge_Set/競品資料/B00NO0FCPQ.xlsx,1
B00NO0FCPQ,1.0,Five Stars,Nice looking guages,5.0,Positive,外觀偏好,2017-04-19,mark a peterson,US,https://www.amazon.com/gp/customer-reviews/RUKW1QPNGRLVD/ref=cm_cr_getr_d_rvw_ttl?ie=UTF8,1,Nice looking guages,正向,1,https://www.amazon.com/gp/profile/amzn1.account.AEDH7PDEMSRIPXYPA3SLYQ4ISC6Q/ref=cm_cr_getr_d_gw_btm,Y,0.0,Review_001_Classic_Gauge_Set/競品資料/B00NO0FCPQ.xlsx,1
B00NO0FTKO,,"Great gauges, great price, 5 stars for sure...","Love the looks of these gauges, easy to follow instructions and easy to install.",5.0,Positive,功能需求,2016-12-18,Mike Heishman,US,https://www.amazon.com/gp/customer-reviews/R2NQEVW8B92XQS/ref=cm_cr_getr_d_rvw_ttl?ie=UTF8,1,"Love the looks of these gauges, easy to follow instructions and easy to install.",正向,3,https://www.amazon.com/gp/profile/amzn1.account.AFVRBDAMWGUUP7GTTZD6IQ3CFEDA/ref=cm_cr_getr_d_gw_btm,Y,2.0,Review_001_Classic_Gauge_Set/競品資料/B00NO0FCPQ.xlsx,1
B00NO0FCPQ,1.0,Five Stars,Nice gauges nice co to deal with,5.0,Positive,價格敏感,2016-11-12,eddie farmer,US,https://www.amazon.com/gp/customer-reviews/R35JYH27Z6Q5TV/ref=cm_cr_getr_d_rvw_ttl?ie=UTF8,1,Nice gauges nice co to deal with,正向,1,https://www.amazon.com/gp/profile/amzn1.account.AGDMKCIZHHF376XTL5UANKE35FNQ/ref=cm_cr_getr_d_gw_btm,Y,1.0,Review_001_Classic_Gauge_Set/競品資料/B00NO0FCPQ.xlsx,1
B00NO0FCPQ,1.0,Five Stars,Good looking and fit perfectly,5.0,Positive,品質信任,2016-11-07,Amazon Customer,US,https://www.amazon.com/gp/customer-reviews/R2IVQJKAYCX6FV/ref=cm_cr_getr_d_rvw_ttl?ie=UTF8,1,Good looking and fit perfectly,正向,1,https://www.amazon.com/gp/profile/amzn1.account.AFBZLDNOL6WN5KPQFXCIK3X4CNJA/ref=cm_cr_getr_d_gw_btm,Y,0.0,Review_001_Classic_Gauge_Set/競品資料/B00NO0FCPQ.xlsx,1
B00NO0FCPQ,1.0,Four Stars,"Installed in a rat rod, I am still trying to see how well the temp gauge is reading right.",4.0,Positive,功能需求,2016-06-27,Dennis M.,US,https://www.amazon.com/gp/customer-reviews/R26ZC2VONK4633/ref=cm_cr_getr_d_rvw_ttl?ie=UTF8,1,"Installed in a rat rod, I am still trying to see how well the temp gauge is reading right.",正向,2,https://www.amazon.com/gp/profile/amzn1.account.AF6NVMDKYRNKGH7GHGNXEVKDA5YA/ref=cm_cr_getr_d_gw_btm,Y,1.0,Review_001_Classic_Gauge_Set/競品資料/B00NO0FCPQ.xlsx,1
B00NO0FEFE,,Five Stars,Beverly nice looking set!,5.0,Positive,外觀偏好,2016-03-14,Jeremy Mason,US,https://www.amazon.com/gp/customer-reviews/R2TV5OVS9M1ZZ5/ref=cm_cr_getr_d_rvw_ttl?ie=UTF8,1,Beverly nice looking set!,正向,1,https://www.amazon.com/gp/profile/amzn1.account.AERP2TAAJD5ABP34DZKJIBUNOD5Q/ref=cm_cr_getr_d_gw_btm,Y,1.0,Review_001_Classic_Gauge_Set/競品資料/B00NO0FCPQ.xlsx,1
B00NO0FCPQ,1.0,Look and operate great,"So far, so good. I'm just having some issues with my truck wiring. I highly recommend the dash panel that Amazon shows in the ""frequently bought together"" list.",5.0,Positive,品質信任,2016-02-29,Cajun Jason,US,https://www.amazon.com/gp/customer-reviews/R2PKX0MCN29UY6/ref=cm_cr_getr_d_rvw_ttl?ie=UTF8,1,"So far, so good. I'm just having some issues with my truck wiring. I highly recommend the dash panel that Amazon shows in the ""frequently bought together"" list.",正向,2,https://www.amazon.com/gp/profile/amzn1.account.AE7ZLJ55GGMB2FNU6WCF76K5ITTA/ref=cm_cr_getr_d_gw_btm,Y,2.0,Review_001_Classic_Gauge_Set/競品資料/B00NO0FCPQ.xlsx,1
B00NO0FCPQ,1.0,Five Stars,"Nice gauges, company was super to deal with.",5.0,Positive,價格敏感,2016-02-11,Amazon Customer,US,https://www.amazon.com/gp/customer-reviews/R166JKTDOH7JYY/ref=cm_cr_getr_d_rvw_ttl?ie=UTF8,1,"Nice gauges, company was super to deal with.",正向,1,https://www.amazon.com/gp/profile/amzn1.account.AEM3F7BVGGSCH7PIXL2JHIHAYFZA/ref=cm_cr_getr_d_gw_btm,Y,2.0,Review_001_Classic_Gauge_Set/競品資料/B00NO0FCPQ.xlsx,1
B00NO0FEFE,,Five Stars,great,5.0,Positive,品質信任,2015-01-22,mark sanders,US,https://www.amazon.com/gp/customer-reviews/RZTIEKQ66M1BC/ref=cm_cr_getr_d_rvw_ttl?ie=UTF8,1,great,正向,1,https://www.amazon.com/gp/profile/amzn1.account.AH3LKYDT3W7VHETIQ53HFDBRGREA/ref=cm_cr_getr_d_gw_btm,,1.0,Review_001_Classic_Gauge_Set/競品資料/B00NO0FCPQ.xlsx,1
B0BZ88PLBS,,ممتازه اوصي به,"الكروم الجانبي ممتاز
يحتاج لاضافة حساس للحراره
لكنه بشكل عام  كامل من جميع النواحي",5.0,Positive,其他,2026-01-14,mansour alhammadi,US,https://www.amazon.com/gp/customer-reviews/R2COACXMD48AJC?ie=UTF8&ASIN=B09DP9V3DP,0,"الكروم الجانبي ممتاز
يحتاج لاضافة حساس للحراره
لكنه بشكل عام  كامل من جميع النواحي",正向,0,,Y,0.0,Review_001_Classic_Gauge_Set/B09DP9V3DP.xlsx,1
B0BZ851KRY,,Baja calidad,Sensores fallan y no son preciosos,1.0,Negative,功能需求,2025-12-05,Daniel Zamorano,MX,https://www.amazon.com.mx/gp/customer-reviews/R2MA3HYZV3N5CP?ie=UTF8&ASIN=B09DP9V3DP,0,Sensores fallan y no son preciosos,負向,1,,Y,0.0,Review_001_Classic_Gauge_Set/B09DP9V3DP.xlsx,1
B081JDPKSV,,La calidad,Bien,4.0,Positive,其他,2025-11-30,Maria Guadalupe Sandoval Ayala,MX,https://www.amazon.com.mx/gp/customer-reviews/RCYD2OL8AWV0F?ie=UTF8&ASIN=B09DP9V3DP,0,Bien,正向,0,,Y,0.0,Review_001_Classic_Gauge_Set/B09DP9V3DP.xlsx,1
B0D4DD23WX,,Que los demás tengan una guía de que tan buenos son los productos,Llegaron muy rapido y son de muy buena calidad,5.0,Positive,其他,2025-07-31,Levi JB,MX,https://www.amazon.com.mx/gp/customer-reviews/R3TELRJTS5879S?ie=UTF8&ASIN=B09DP9V3DP,0,Llegaron muy rapido y son de muy buena calidad,正向,0,,Y,0.0,Review_001_Classic_Gauge_Set/B09DP9V3DP.xlsx,1
B081JDPKSV,,Gauge cluster,"Proper sizing, seems to be good quality, all accessories included.",4.0,Positive,品質信任,2025-04-17,Gordon Mills,CA,https://www.amazon.ca/gp/customer-reviews/R3DWDA2ZXNVC8D?ie=UTF8&ASIN=B09DP9V3DP,0,"Proper sizing, seems to be good quality, all accessories included.",正向,2,,Y,0.0,Review_001_Classic_Gauge_Set/B09DP9V3DP.xlsx,1
B0793N7B7P,9.0,falta tornillería,es la segunda vez que lo compro y llega faltante de tornillería delos instrumentos,2.0,Negative,其他,2025-04-07,Jaime M.,MX,https://www.amazon.com.mx/gp/customer-reviews/R2VXJN97DM451S?ie=UTF8&ASIN=B09DP9V3DP,0,es la segunda vez que lo compro y llega faltante de tornillería delos instrumentos,負向,0,,Y,0.0,Review_001_Classic_Gauge_Set/B09DP9V3DP.xlsx,1
B0BZ851KRY,,"Muy bueno, la mejor opción",Muy buen producto con instrucciones y todo listo para instalar,5.0,Positive,其他,2025-03-27,D5,MX,https://www.amazon.com.mx/gp/customer-reviews/R3NXYSP89V4BAS?ie=UTF8&ASIN=B09DP9V3DP,0,Muy buen producto con instrucciones y todo listo para instalar,正向,0,,Y,0.0,Review_001_Classic_Gauge_Set/B09DP9V3DP.xlsx,1
B0952STSM5,14.0,muy bueno,Excelente calidad,5.0,Positive,其他,2023-06-22,Jose Roberto Ramirez Suarez,MX,https://www.amazon.com.mx/gp/customer-reviews/R1R50QW0UHB3JL?ie=UTF8&ASIN=B09DP9V3DP,0,Excelente calidad,正向,0,,Y,0.0,Review_001_Classic_Gauge_Set/B09DP9V3DP.xlsx,1
B081JDKD5X,,Buenos recomendados,Muy fácil de instalar viene con todo sus accesorios recomendados al 100%,5.0,Positive,其他,2022-02-24,SR.FISHER,MX,https://www.amazon.com.mx/gp/customer-reviews/R8SXI1B0XEL7U?ie=UTF8&ASIN=B09DP9V3DP,0,Muy fácil de instalar viene con todo sus accesorios recomendados al 100%,正向,0,,Y,2.0,Review_001_Classic_Gauge_Set/B09DP9V3DP.xlsx,1
B0793LBDGY,4.0,Oil pressure sending unit faulty tach jumps allover,Made dash to mount gauges trusting they would work to much work to take back out of vechicle,1.0,Negative,功能需求,2021-10-08,Arthur joseph,CA,https://www.amazon.ca/gp/customer-reviews/R2PHLENSTCPZ9F?ie=UTF8&ASIN=B09DP9V3DP,0,Made dash to mount gauges trusting they would work to much work to take back out of vechicle,負向,3,,Y,0.0,Review_001_Classic_Gauge_Set/B09DP9V3DP.xlsx,1
B0BZ88PLBS,,ممتازه اوصي به,"الكروم الجانبي ممتاز
يحتاج لاضافة حساس للحراره
لكنه بشكل عام  كامل من جميع النواحي",5.0,Positive,其他,2026-01-14,mansour alhammadi,US,https://www.amazon.com/gp/customer-reviews/R2COACXMD48AJC?ie=UTF8&ASIN=B0793LBDGY,0,"الكروم الجانبي ممتاز
يحتاج لاضافة حساس للحراره
لكنه بشكل عام  كامل من جميع النواحي",正向,0,,Y,0.0,Review_001_Classic_Gauge_Set/B0793LBDGY.xlsx,1
B0BZ851KRY,,Baja calidad,Sensores fallan y no son preciosos,1.0,Negative,功能需求,2025-12-05,Daniel Zamorano,MX,https://www.amazon.com.mx/gp/customer-reviews/R2MA3HYZV3N5CP?ie=UTF8&ASIN=B0793LBDGY,0,Sensores fallan y no son preciosos,負向,1,,Y,0.0,Review_001_Classic_Gauge_Set/B0793LBDGY.xlsx,1
B081JDPKSV,,La calidad,Bien,4.0,Positive,其他,2025-11-30,Maria Guadalupe Sandoval Ayala,MX,https://www.amazon.com.mx/gp/customer-reviews/RCYD2OL8AWV0F?ie=UTF8&ASIN=B0793LBDGY,0,Bien,正向,0,,Y,0.0,Review_001_Classic_Gauge_Set/B0793LBDGY.xlsx,1
B0D4DD23WX,,Que los demás tengan una guía de que tan buenos son los productos,Llegaron muy rapido y son de muy buena calidad,5.0,Positive,其他,2025-07-31,Levi JB,MX,https://www.amazon.com.mx/gp/customer-reviews/R3TELRJTS5879S?ie=UTF8&ASIN=B0793LBDGY,0,Llegaron muy rapido y son de muy buena calidad,正向,0,,Y,0.0,Review_001_Classic_Gauge_Set/B0793LBDGY.xlsx,1
B081JDPKSV,,Gauge cluster,"Proper sizing, seems to be good quality, all accessories included.",4.0,Positive,品質信任,2025-04-17,Gordon Mills,CA,https://www.amazon.ca/gp/customer-reviews/R3DWDA2ZXNVC8D?ie=UTF8&ASIN=B0793LBDGY,0,"Proper sizing, seems to be good quality, all accessories included.",正向,2,,Y,0.0,Review_001_Classic_Gauge_Set/B0793LBDGY.xlsx,1
B0793N7B7P,9.0,falta tornillería,es la segunda vez que lo compro y llega faltante de tornillería delos instrumentos,2.0,Negative,其他,2025-04-07,Jaime M.,MX,https://www.amazon.com.mx/gp/customer-reviews/R2VXJN97DM451S?ie=UTF8&ASIN=B0793LBDGY,0,es la segunda vez que lo compro y llega faltante de tornillería delos instrumentos,負向,0,,Y,0.0,Review_001_Classic_Gauge_Set/B0793LBDGY.xlsx,1
B0BZ851KRY,,"Muy bueno, la mejor opción",Muy buen producto con instrucciones y todo listo para instalar,5.0,Positive,其他,2025-03-27,D5,MX,https://www.amazon.com.mx/gp/customer-reviews/R3NXYSP89V4BAS?ie=UTF8&ASIN=B0793LBDGY,0,Muy buen producto con instrucciones y todo listo para instalar,正向,0,,Y,0.0,Review_001_Classic_Gauge_Set/B0793LBDGY.xlsx,1
B0952STSM5,14.0,muy bueno,Excelente calidad,5.0,Positive,其他,2023-06-22,Jose Roberto Ramirez Suarez,MX,https://www.amazon.com.mx/gp/customer-reviews/R1R50QW0UHB3JL?ie=UTF8&ASIN=B0793LBDGY,0,Excelente calidad,正向,0,,Y,0.0,Review_001_Classic_Gauge_Set/B0793LBDGY.xlsx,1
B081JDKD5X,,Buenos recomendados,Muy fácil de instalar viene con todo sus accesorios recomendados al 100%,5.0,Positive,其他,2022-02-24,SR.FISHER,MX,https://www.amazon.com.mx/gp/customer-reviews/R8SXI1B0XEL7U?ie=UTF8&ASIN=B0793LBDGY,0,Muy fácil de instalar viene con todo sus accesorios recomendados al 100%,正向,0,,Y,2.0,Review_001_Classic_Gauge_Set/B0793LBDGY.xlsx,1
B0793LBDGY,4.0,Oil pressure sending unit faulty tach jumps allover,Made dash to mount gauges trusting they would work to much work to take back out of vechicle,1.0,Negative,功能需求,2021-10-08,Arthur joseph,CA,https://www.amazon.ca/gp/customer-reviews/R2PHLENSTCPZ9F?ie=UTF8&ASIN=B0793LBDGY,0,Made dash to mount gauges trusting they would work to much work to take back out of vechicle,負向,3,,Y,0.0,Review_001_Classic_Gauge_Set/B0793LBDGY.xlsx,1
